{
  "签号": "第九签",
  "签名": "四太子初伐中原",
  "签文类型": "时秋晚节之兆",
  "卦象": "中平之卦",
  "生肖": "子鼠",
  "签文简介": {
    "戏文": "金四太子兀术初伐中原，破路安州，守将陆登自刎而挺立，兀术敬拜之始倒。因敬其英烈，乃收养其幼子陆文龙。后宋将王佐断臂诈降入金，得奶母助，策反双枪陆文龙归宋。祖父子四状元者是也。",
    "诗曰": "舟戏长江水，风在浪更涛;大蛇侵户俑，五鬼弄刀枪。",
    "内兆": "兰菊芬菲"
  },
  "家宅运势": {
    "签文": "只望家和万事成，年来愁闷未曾伸，因何不把家神敬，门户无人有响声。",
    "解曰": "吉宅人口可得喜气，家欲和气万事可成，但防夏月疾难祸非涉财，吓佛祖保平安，又嫌门轻重畔，灶位不美，各宜修整，祖上香灯要拜到则安。"
  },
  "岁君签": {
    "总诗": "芳兰春景真堪爱，菊吐秋光色又佳，乾坤各自惟消息，不假春风次第开。",
    "年龄运势": [
      {
        "年龄": "1-3岁",
        "男": "小儿根基足养，八字清格，有旺益上人并茂，四、五、七月小疾无妨，卦中吉星守度平安。",
        "女": "小女根苗足养，有利益上人并茂，四、五、七月虽有小皮恙无妨，吉星守命平安。"
      },
      {
        "年龄": "4-7岁",
        "男": "小儿之卦，运限精通，天真活泼，虽有小疾无妨，水边小心，幸有吉星守命平安。",
        "女": "小女今年运限顺吉，各事伶俐，有旺益上人并茂，但池井边小心，幸有吉星守度平安。"
      },
      {
        "年龄": "8-12岁",
        "男": "小儿之卦时令亨通，伶俐活泼，可培养入学，定卜进步平安，但池井边小心，幸吉星守度平安。",
        "女": "小女今年时令顺遂，各事通窍，有旺益上人并茂，但水边小心，吉星守度平安。"
      },
      {
        "年龄": "13-15岁",
        "男": "童造运度叶吉，做事聪明，可入学校读书，定卜进步，正、四、五月虽有小疾无妨，吉星守命平安。",
        "女": "小女今年交上美运，各事精通，旺益家门，正、四、五月虽有小疾无妨，水边小心，底子平安。"
      },
      {
        "年龄": "16-17岁",
        "男": "祥造步运亨通，如兰菊芬芳，做事通能，可培养入学，定卜前途进展，出入平安。",
        "女": "玉造行运交泰，如兰菊芬芳，技巧聪明，正、四、五月虽有小疾无妨，吉星守度平安。"
      },
      {
        "年龄": "18-29岁",
        "男": "英造步运亨通，如兰菊芬芳，奇才通达，可得财喜，正、四、五月戒忍口舌，贵人扶助出入平安。",
        "女": "美造行运顺遂，如兰菊芬芳，各事贤玉，助益家庭，正、四、五月小疾无妨，吉星守度平安。"
      },
      {
        "年龄": "30-55岁",
        "男": "乾造步运亨通，做事才能特达，虽可得财喜，但正、四、五月防小人口舌，幸贵人扶助平安。",
        "女": "坤造行运交泰，如兰菊芬芳，但嫌操心，凡事吞忍，虽有小暗疾口舌无妨，吉星守命平安。"
      },
      {
        "年龄": "56-69岁",
        "男": "台造步运亨通，为人老练忠诚，可得财运，但凡事宽怀大量，正、四、五月戒忍口舌，幸贵人扶助平安。",
        "女": "坤造行运顺遂，可称内助，人贤惠，但防暗疾口舌，宜忍性，幸吉星守度出入平安。"
      },
      {
        "年龄": "70岁以上",
        "男": "台造步运，随是老当益壮，但防灾难跌地之厄，正、四、五月上落小心，则大吉平安。",
        "女": "妇造老运虽有旺益子孙，但防暗疾上身，正、四、五月喜孝物勿食，守旧，晚景胜前，底子平安。"
      }
    ]
  },
  "生意": {
    "生意": "春夏时运还未通，生意平平利轻松，货物留下秋东卖，时到运开利倍浓。",
    "生意解曰": "生意虽有利可得，但防夏月阻隔，交秋后有贵人扶助似兰菊芳芬得后利。",
    "开铺": "开铺宜从正道应防歹人劫物，铺勿离人，财勿露眼，请佛祖令旗安门上平安。",
    "合伙": "卜合伙之卦有利但伙计宜忠直勿贪心凡事要能同心协力，要忍口舌秋后可得顺利。",
    "置货": "卜置货上春小利，宜现买现卖，候交秋冬月经营利路宏开。"
  },
  "出外": {
    "出外": "卜出外一事要有胆气坚定前往于二，四月有贵人扶助，可得名利双全。"
  },
  "谋望求财": {
    "谋望": "昔年许汝到春来，岂料经营意不谐，且待菊梅开结日，依然名利两成材。",
    "谋望解曰": "卜谋事成，但须切防口舌候四，五月谋之并托人帮助，交秋冬时便可成功。",
    "求财": "正财库取利夏月利少，但宜刻苦维持交九，十月起返运财源广进可得厚利，偏财有利可得，但切不得外涉消息。"
  },
  "学艺功名": {
    "学艺": "卜学艺之卦，上春时运未到，勿学为佳，候秋后择吉日，拜良师学之便可成功。",
    "功名": "功名半吉，若勤奋用功学习，定能得吕。"
  },
  "行舟六畜": {
    "行舟": "行舟中吉，四、九月顺风大吉也。",
    "六畜": "君若要养猪牛羊，成群有阻一二良。求吓神明力保佑，秋交冬至财利添。",
    "猪羊": "卜猪羊之卦，不可成群，养一二只为佳，防阻失吓伯公保佑，有厚利。",
    "草龙": "饲养草龙，应下功料理，可旺益家庭，宜求伯公香火带平安。",
    "三鸟": "饲养三鸟，春夏养之恐有阻失，秋冬养之有大利，上年有失过者，今年二月起养之兴旺。",
    "田蚕": "田蚕中吉，早晚冬一样，四季雨水皆同。"
  },
  "移徙": {
    "移徙": "移徙本乡勿移，移之不吉，他乡犹可。"
  },
  "行人": {
    "诗": "人坐依然音信稀，如今何用意踌躇。春兰秋菊因时候，各自根苗待吐枝。",
    "解曰": "行人在外身体平安，有贵人扶助，候四、七、九月有信息回家，此后捷报频传。"
  },
  "婚姻": {
    "婚姻": "婚欲成时待月圆，不须心下意悬悬，虽然好段婚缘事，怎奈他人尚未坚。",
    "解曰": "婚姻成之但初时人心还未坚,不要急迫候待月圆便可说合下出聘也。"
  },
  "官讼": {
    "官讼": "成人不用苦心头，恐有文词讼人交。凡事抽身归去好，闭门静坐做闲巢。",
    "解曰": "此讼宜和，不可告之，不要理它，百忍不灾也，若告之，恐大费精神，不顺也。"
  },
  "失物": {
    "失物": "自失如何却怨天，神公岂肯为谁怜。依君若要真消息，细心访寻须待年。",
    "解曰": "物已失去不可怨天也，不可猜疑邻居，要知真消息必须等待来年，或许得见。"
  },
  "占病": {
    "占病": "此事厌厌怨满怀，未逢良药事和谐。平安等待三更后，获取从交福降来。",
    "解曰": "生病不可随便怨恨，此病不危，良医未到，到了便病好福来也。"
  },
  "其他": {
    "灶君": "卜此灶位合课，但嫌窗前煞冲照，且灶前秽气，时常修洗干净，遮盖煞气，大吉。",
    "阳基": "卜起造阳基嫌右方有庙煞，宜掩祭起造大吉，老阳宅嫌门前误会，宜修净居之大吉。",
    "六甲": "卜此胎六甲生男，大吉顺，阖家老少欢喜，宜吓神明保佑养育平安。",
    "子息": "卜子息之卦，以前多花，后必结果，现岁怀孕生男，昔年生女，后台即可生男。",
    "祖山": "卜贵祖佳城横龙坠气结穴，气脉足旺，但嫌唇口出水分金不美，又嫌得西分前分金不旺，如坐向有利各宜修整，财丁旺也。",
    "青草": "此地横龙坠气结穴气脉足旺，但嫌右方有煞冲伤，葬时宜消掩冲煞并修水神归口，葬后财丁兴旺，老少和美也。"
  }
}