{
  "签号": "第二十六签",
  "签名": "姜太公遇文王",
  "签文类型": "新月如弓之兆",
  "卦象": "大吉之卦",
  "生肖": "未羊",
  "签文简介": {
    "戏文": "武吉毙人伏罪，得姜尚教化，逃脱周文王先天算法。缘此文王知姜尚为异人，必有经世奇才，往访之不遇，复斋戒沐浴，亲驾渭滨，迎请同治乱世。王让车辇以载姜尚，并为之御。姜推让，步行八十步，主周室绵历八百年之数。时姜尚八十初度，始展其志，助文王灭纣兴周。",
    "诗曰": "四泽春水深，静处值怀音;天书传好事，喜气入渭津。",
    "内兆": "新月如弓"
  },
  "家宅运势": {
    "签文": "敬神自在心头欢，门户光明万事安，不但田蚕皆兴旺，谁知失落不相干。",
    "解曰": "吉宅可有喜气临门，但人口防四，六，九月有口舌痛疾，还防火盗之厄，是厝前受杀，白虎畔有石冲伤，宜求佛祖福灯安门上祭化居住大吉。"
  },
  "岁君签": {
    "总诗": "安居旺相进田蚕，天上生云地下雷，禄位高升光显达，荣华富贵入门来。",
    "年龄运势": [
      {
        "年龄": "1-3岁",
        "男": "小孩根苗稳固，八字清格，有旺益上人并茂，喜孝物勿近，幸吉星守度平安。",
        "女": "小女根基足养，有旺益上人，三、四、七月小疾无妨，有吉星照身，可卜出入平安。"
      },
      {
        "年龄": "4-7岁",
        "男": "小儿现年运限亨通，天真活泼，旺益上人，三、四、七月水厄小心，幸吉星守命，出入平安。",
        "女": "小女现年运限顺遂，伶俐精神，有旺益上人，三、四、七月水边小心，吉星守命，出入平安。"
      },
      {
        "年龄": "8-12岁",
        "男": "小儿运度叶吉，性质活泼，宜入学校读书，定卜进步，水边小心，吉星守命平安。",
        "女": "小女运限顺吉，精神通畅，三、四、七月虽有小疾无妨，水边小心，幸吉星守命平安。"
      },
      {
        "年龄": "13-15岁",
        "男": "童造今年交上运，各事聪明开窍，培养入学，定卜前途进展，小疾无妨，出入平安。",
        "女": "小女今年运度甚佳，各事技巧，通情达理，三、四、七月小皮疾无妨，吉星照身平安。"
      },
      {
        "年龄": "16-17岁",
        "男": "祥造现年运度亨通，签文如新月挂弓之兆，各事通能，可学习文化，定卜前途远大，出入平安。",
        "女": "玉造行运甚美，签文新月挂弓之兆，为人贤玉智慧，三、四、七月小疾无妨，出入平安。"
      },
      {
        "年龄": "18-29岁",
        "男": "英造步运亨通，如新月挂弓，做事特达，宜向外发展，春夏月小疾无妨，贵人扶助可得财喜平安。",
        "女": "玉造行运顺利，如新月挂弓，五行清秀，助益家庭，三、四、七月虽有小疾无妨，有吉星守度平安。"
      },
      {
        "年龄": "30-55岁",
        "男": "乾造步运亨通，如新月挂弓，凡事老练经济，从正发展，定卜有贵人扶助，可得财喜出入平安。",
        "女": "坤造行运佳美，如新月挂弓，各事贤惠，有内助之称，但勿迫切，三、四、七月虽有暗疾无妨平安。"
      },
      {
        "年龄": "56-69岁",
        "男": "台造步运亨通，为人忠诚耿直，但凡事宽怀，有小人口舌无妨，卦中有贵人扶助，出入平安。",
        "女": "坤造行运交泰，贤淑智慧，虽有旺益家庭，但嫌操心迫切，有些小暗疾无妨，出入平安。"
      },
      {
        "年龄": "70岁以上",
        "男": "福造老运亨通，老当益壮，凡事涵养，三、四、七月小疾无妨，有贵人扶助，福体安康。",
        "女": "坤造老运顺吉，旺益子孙，但有些暗疾无妨，喜孝物勿近，吉星守命，晚景胜前。"
      }
    ]
  },
  "生意": {
    "生意": "新开商店春夏盈，旧业经营夏平平，欲问交易何时旺，中秋时节财利生。",
    "生意解曰": "新创业春夏得厚利，宜用苦力维持，秋后可得财利",
    "开铺": "若新开张铺户，可卜财源广进，若老铺经营春夏月小得，秋后转运可得厚利也。",
    "合伙": "卜合伙之卦叶吉协力经营有财利可得，但恐合不长久，必须谨慎注意也!",
    "置货": "卜置货恐购货时市情败退，但无妨，候交秋后货物振价，可得财利也。"
  },
  "出外": {
    "出外": "运气方盛宜出运方，有贵人扶助各事得心应想，可得名利双全!"
  },
  "谋望求财": {
    "谋望": "运至方得出运邦，自然财宝聚衣厢，名利喜在随人欲，却笑浮生空白忙。",
    "谋望解曰": "谋事可成但防口舌，宜用苦力，候交秋后有贵人扶助，即可成功也!",
    "求财": "正财取之大吉但春夏月财利稀薄，宜刻苦经营，秋后有贵人可得财利，偏财勿取恐有是非!"
  },
  "学艺功名": {
    "学艺": "卜学技艺之卦虽合课，但嫌虎头蛇尾，恐半途而废，若能下决心学习者，定能技艺随身。",
    "功名": "功名不成，文武者皆不中也。"
  },
  "行舟六畜": {
    "行舟": "行舟平和，要刻苦勤谨。",
    "六畜": "各类六畜各不同，冬月养猪恐阻难。牛羊养之顺又吉，鸡犬养之也平安。",
    "猪羊": "",
    "草龙": "",
    "三鸟": "",
    "田蚕": ""
  },
  "移徙": {
    "移徙": ""
  },
  "行人": {
    "解曰": "",
    "签文": ""
  },
  "婚姻": {
    "解曰": "婚姻定成且不用媒人，前缘注定五百年前结成同心同德，互敬互爱",
    "签文": "好对婚姻不用谋，有心不必急相催，前生注定非今日，五百年前结果来。"
  },
  "官讼": {
    "解曰": "",
    "签文": ""
  },
  "失物": {
    "解曰": "",
    "签文": ""
  },
  "占病": {
    "解曰": "",
    "签文": ""
  },
  "其他": {
    "灶君": "",
    "阳基": "",
    "六甲": "",
    "子息": "",
    "祖山": "",
    "青草": ""
  }
}