{
  "签号": "第四十二签",
  "签名": "唐天子得国公",
  "签文类型": "囚人遇赦之兆",
  "卦象": "上上之卦",
  "生肖": "卯兔",
  "签文简介": {
    "戏文": "徐茂公观于星台，知定阳王先锋尉迟恭为将星，上达听天。李世民爱才如命，苦求之。尉迟恭以不事二主拒不归唐。徐茂公计杀其主刘武周。李世民屈尊为之行丧，厚葬刘武周；并屈身钻从尉迟恭鞍下过。其求将真诚至此，尉迟恭感李知遇之恩，乃助唐打定天下，立开国奇功，封史国公。",
    "诗曰": "否极当逢泰，云开月更明;不言来相请，宣我上蓬瀛。",
    "内兆": "如鱼得水"
  },
  "家宅运势": {
    "签文": "今年喜庆事如何，人口无休畜产多，秋去冬初些小悔，更祷神佑保融和。",
    "解曰": "吉宅气临门，但恐防九，十一月疾难口舌，阻六畜火星小心，宜求本境地头老爷保平安，是埕口水道不美宜常修清洁居住财丁昌盛。"
  },
  "岁君签": {
    "总诗": "鱼游出水戏波浪，跳跃优游非等闲，喜逢泰来万事吉，更无阻险在其间。",
    "年龄运势": [
      {
        "年龄": "1-3岁",
        "男": "小孩根苗足养，八字成格，有旺益上辈并茂，三、四月虽有小疾无妨，寿命绵长。",
        "女": "小女根基足旺，利益上辈，三、四月虽有小皮疾无妨，卦中吉星守命平安。"
      },
      {
        "年龄": "4-7岁",
        "男": "小儿之卦运限顺遂，生性天真，旺益上人，但三、四月消极无妨，幸吉星守命平安。",
        "女": "小女运限叶吉，凡事伶俐活泼，旺益上人，三、四月水边小心，幸吉星守命平安。"
      },
      {
        "年龄": "8-12岁",
        "男": "小儿今年上运，凡事伶俐天真，宜入学校读书，定卜进步，水边小心，底子平安。",
        "女": "小女现年运度亨通，活泼伶俐，旺益上人并茂，三、四月水边勿近，底子平安。"
      },
      {
        "年龄": "13-15岁",
        "男": "小童之卦叶吉，生性聪明开窍，宜入学校温习文化，定卜进步，远景有望，出入平安。",
        "女": "小女现年运度未遂，三、四月有小疾无妨，但水边小心，幸有吉星守命出入平安。"
      },
      {
        "年龄": "16-17岁",
        "男": "祥造时令亨通，如鱼得水，各事精通，可再培养，三、四月虽有小疾无妨，贵人扶助出入平安。",
        "女": "玉造现年运度甚美，签文如鱼得水，八字清秀，宜学艺业，三、四月小疾无妨，吉星照身平安。"
      },
      {
        "年龄": "18-29岁",
        "男": "乾造步运亨通，如鱼得水，做事才能特达，三、四月虽有小人口舌无妨，贵人扶助可得财喜平安。",
        "女": "坤造行运交泰，签文如鱼得水，凡事贤玉，可称女界之英，三、四月虽有小疾无妨，出入平安。"
      },
      {
        "年龄": "30-55岁",
        "男": "乾造步运亨通，签文如鱼得水，性格刚直，可得财喜，但三、四月戒忍口舌，贵人扶助出入平安。",
        "女": "坤造行运佳美，如鱼得水，可称内助，三、四月虽有小疾无妨，幸卦中吉星照身出入平安。"
      },
      {
        "年龄": "56-69岁",
        "男": "台造步运上吉，为人忠诚老练，有财运美，但三、四月戒忍口舌，虽有暗疾无妨，贵人扶助平安。",
        "女": "坤造行运甚美，签文如鱼得水，凡事贤淑智慧，但勿操迫，虽有暗疾无妨，吉星守命平安。"
      },
      {
        "年龄": "70岁以上",
        "男": "台造老运安康，老当益壮，但嫌得此卦险阻二字出现，三、四月上落小心，幸福星拱照平安。",
        "女": "妇造老运虽有旺益子孙，但防老风暗疾，三、四月守旧，忌入丧门，幸吉星守命平安。"
      }
    ]
  },
  "生意": {
    "生意": "如今得志上青云，谋望求财总遂君，秋末冬初利更重，偏财夏阻冬成堆。",
    "生意解曰": "现年生意兴隆，但防夏月亏本，五，九，十一月如鱼得水，有贵人可得厚财利",
    "开铺": "卜开铺之卦如鱼得水之兆春夏月防祸非失财，秋后转运否极泰来，有厚财大利。",
    "合伙": "卜合伙之卦叶吉，但春夏月还要防歹人有不仁之心，若伙计同心协力，秋后可得厚财利也。",
    "置货": "卜置货初时恐亏本，但要有志气胆智，置后渐且停留，秋后振价，可得厚财利也。"
  },
  "出外": {
    "出外": "此次出外叶吉，但嫌心意未定，应有胆智前往三，五月有贵人扶助，可获财利!"
  },
  "谋望求财": {
    "谋望": "地冷天寒水作冰，安心守志待仓清，如今正遇阳和日，四海优游任往行。",
    "谋望解曰": "谋事初阻挡不称心，须立志坚持，候交秋月有贵人扶助定可成功",
    "求财": "正财上春跋涉宜立志维持，谨慎谋之候五，九，十一月如鱼得水，有厚财利可得，偏财也财样，但不能贪也!"
  },
  "学艺功名": {
    "学艺": "卜学技艺之卦，初恐不如意，但应不畏艰难坚持学习，必能得真艺也。",
    "功名": "如龙升腾，贵人扶助，可攀丹桂也。"
  },
  "行舟六畜": {
    "行舟": "行舟平安，上春有小阻，下春大吉。",
    "六畜": "君问饲养猪牛羊，劳心劳力有得钱。枯木逢春色欲华，菊吐芬芳财利长。",
    "猪羊": "",
    "草龙": "",
    "三鸟": "",
    "田蚕": ""
  },
  "移徙": {
    "移徙": ""
  },
  "行人": {
    "解曰": "",
    "签文": ""
  },
  "婚姻": {
    "解曰": "天配良缘如鱼得水，立时可成定能同心同德，白头皆老",
    "签文": "天设良缘两相宜，如鱼得水戏河池，此时若得成连娌，那堪相许也相依。"
  },
  "官讼": {
    "解曰": "",
    "签文": ""
  },
  "失物": {
    "解曰": "",
    "签文": ""
  },
  "占病": {
    "解曰": "",
    "签文": ""
  },
  "其他": {
    "灶君": "",
    "阳基": "",
    "六甲": "",
    "子息": "",
    "祖山": "",
    "青草": ""
  }
}