{
  "签号": "第四十六签",
  "签名": "刘邦斩白蛇",
  "签文类型": "新月朦胧之兆",
  "卦象": "下下之卦",
  "生肖": "亥猪",
  "签文简介": {
    "戏文": "汉高祖刘邦初为伍长，解民工赴造长城，误期则问斩，不意遇白蛇挡路，不得行。刘邦将之腰斩，当晚刘邦梦有老妪哭诉于前曰：“白帝之子被赤帝之子所杀。”刘邦始知自身为帝王身，遂举事反秦，计败项羽，定鼎汉室。后白蛇传转为王莽，篡乱刘氏江山，以报此仇。",
    "诗曰": "犬儿生两口，柳眼泪珠浮;悲叹无情绪，心酸自苦忧。",
    "内兆": "恶星占身"
  },
  "家宅运势": {
    "签文": "家内作怪假疑真，无端思梦又惊人，要知因甚为多事，只为伊家少福神。",
    "解曰": "喜气临门，但防六，九，十二月口舌祸非失财，地灵不旺，灶位不美，宜择吉日修整安灵，谢土地神向佛祖奉经保佑合家平安。"
  },
  "岁君签": {
    "总诗": "虫蛇入梦主忧疑，慎防家门口舌非，将来运遇方为吉，进退如今未遇时。",
    "年龄运势": [
      {
        "年龄": "1-3岁",
        "男": "小孩根基未足旺，但防四、六、九月小疾波阻，六甲妇勿近抱，吓月娘化吉方保平安。",
        "女": "小女根苗浅薄，惟防四、六、九月多生皮肤灾疾，吓月娘化吉交秋平安。"
      },
      {
        "年龄": "4-7岁",
        "男": "小儿现年时令未美，但防四、六、九月小疾波阻，夜时勿外出，吓天地方保平安。",
        "女": "小女现年运度未遂，但防波阻多事，守旧，四、六、九月夜勿远出，吓月娘化吉平安。"
      },
      {
        "年龄": "8-12岁",
        "男": "小儿运限未美，惟防上春月有些小波阻，学习文化，吓天地化吉方保出入平安。",
        "女": "小女现年时令未佳，虽旺益上人，但防四、六、九月小疾多事，吓天地化吉方保平安。"
      },
      {
        "年龄": "13-15岁",
        "男": "童造时令未美，虽聪明，但嫌执僻，防四、六、九月波阻，培养入学，吓天地保平安。",
        "女": "小女时令未佳，凡事勿执僻，防四、六、九月灾难多事，宜吓天地化吉方保平安。"
      },
      {
        "年龄": "16-17岁",
        "男": "祥造时令不佳，签文新月朦胧之兆，防春夏月小疾波阻，勿执己意，吓天地化吉，交秋转运平安。",
        "女": "玉造现年运度不佳，签文新月朦胧之兆，人虽精巧但防上春月多事小疾，吓天地交秋可卜平安。"
      },
      {
        "年龄": "18-29岁",
        "男": "英造步运不美，如新月不清，虽有奇才，但防上春月小人祸非口舌，吓天地交秋转运平安。",
        "女": "美造行运不佳，人虽贤玉，但防小疾口舌，凡事吞忍，勿迫性，上春月守旧，吓天地，交秋转运平安。"
      },
      {
        "年龄": "30-55岁",
        "男": "乾造步运未美，人虽才能，但签文新月不清，惟防上春月歹人嫁祸生非，戒性，交秋转运平安。",
        "女": "坤造行运美中不足，签文新月不清，虽有智慧，但防上春月暗疾口舌，戒性，交秋转运平安。"
      },
      {
        "年龄": "56-69岁",
        "男": "台造步运未美，如新月朦胧之兆，人老性迫，凡事宽怀大量，上春月闲事勿近理，交秋转运平安。",
        "女": "坤造行运美中不足，虽可称内助之贤，但防暗疾口舌，凡事温柔忍性，春夏月宜守旧，交秋转运平安。"
      },
      {
        "年龄": "70岁以上",
        "男": "福造老运不旺，惟防灾难跌地之厄，早晚上落小心，忌入丧门，守旧，交秋平安。",
        "女": "慈造老运不旺，虽有旺益子孙，但防暗疾风气，春夏月守旧，勿看病人，则吉。"
      }
    ]
  },
  "生意": {
    "生意": "正二两月守旧框，四九两月小人防，三心二意财难得，偏财勿取正财攀。",
    "生意解曰": "做事不可三心二意，宜守旧业四，九月防小人累劫，秋冬可得利，肖羊之人不可原业经营",
    "开铺": "卜开铺之卦不美如新月不清之兆，防四，六，九月阴失，宜立财帛星君镇宅，求佛祖保平安。",
    "合伙": "卜合伙之卦不吉有恶星占身，有小人祸害，勿合为要，若要合之恐吓惹祸非破财，后悔莫及也。",
    "置货": "二三月宜守旧，现买现卖有小利，四、五、九月防小人劫货，余月置货可得利也。"
  },
  "出外": {
    "出外": "卜出外之卦恶星占异，不可往，往之有小人祸累，宜从旧业勤谨工作，可保平安!"
  },
  "谋望求财": {
    "谋望": "心南心北尚迟疑，成否如值未遇期，名利要求非此日，宽心宜守待明时。",
    "谋望解曰": "肖牛之人谋之定成，余者阻挡生口舌，若肖猪犬龙之人勿谋之，原业免生祸非失财",
    "求财": "偏财至切不可取，取之有祸非，正财宜守旧并忍口舌，勿三心二意须立智经营交六，八，十一月可得中财利!"
  },
  "学艺功名": {
    "学艺": "卜学技艺之卦，有恶星占身，有小人祸害，君时运未至，勿学也，宜购书自学也。",
    "功名": "功名不中，是时时运不通，捐纳也无中纳。"
  },
  "行舟六畜": {
    "行舟": "行舟防风不顺，不可开行。",
    "六畜": "猪犬牛羊不平安，若要多养难保全。吓地头爷来保佑，少养只能得平安。",
    "猪羊": "",
    "草龙": "",
    "三鸟": "",
    "田蚕": ""
  },
  "移徙": {
    "移徙": ""
  },
  "行人": {
    "解曰": "",
    "签文": ""
  },
  "婚姻": {
    "解曰": "婚姻不成，成之无用，非远计也，如果是失夫的可娶",
    "签文": "婚眷无缘岂易逢，也难进退两三重，从来勉强成婚事，只恐相逢在梦中。"
  },
  "官讼": {
    "解曰": "",
    "签文": ""
  },
  "失物": {
    "解曰": "",
    "签文": ""
  },
  "占病": {
    "解曰": "",
    "签文": ""
  },
  "其他": {
    "灶君": "",
    "阳基": "",
    "六甲": "",
    "子息": "",
    "祖山": "",
    "青草": ""
  }
}