{
  "签号": "第三十六签",
  "签名": "文王遇凤鸣",
  "签文类型": "凿石见金之兆",
  "卦象": "上上之卦",
  "生肖": "酉鸡",
  "签文简介": {
    "戏文": "周文王先古明君，知天任，施仁政，重教化，少刑罚，史称划地为牢，竖木为吏，垂衣而治者是也。故时世昌盛，民风敦厚。日文王进香岐山，替民祈福，有凤凰来朝帝驾。凤出则斯世盛、君圣民也良，此周朝所以称为礼乐之邦者故也。",
    "诗曰": "八仙同宴会，五马入门来;凤舞天地坠，金盘捧玉杯。",
    "内兆": "如鱼化龙"
  },
  "家宅运势": {
    "签文": "瑞气迎祥百事新，贵人相逢便相亲，秋冬小有淹留阻，春夏人财事事亨。",
    "解曰": "吉宅人口之卦可得喜气临门,但签文有淹留两字，恐防夏月涉财是埕口秽气不净，宜经常修理清洁水道流通，居住财丁兴旺。"
  },
  "岁君签": {
    "总诗": "鱼翻浪跳当三月，此身方起化为龙，他时得位方为吉，百事无忧方变新。",
    "年龄运势": [
      {
        "年龄": "1-3岁",
        "男": "小孩根基足养，八字清秀，有旺益上人并茂，三、五月小疾无妨，寿命绵长。",
        "女": "小女根苗足养，利益上人并茂，三、五、八月虽有小疾无妨，吉星照身出入平安。"
      },
      {
        "年龄": "4-7岁",
        "男": "小儿之卦运限叶吉，有旺益上人，但水边小心，虽有小疾无妨，吉星守命出入平安。",
        "女": "小女现年运限顺遂，但三、五月水边小心，幸吉星守命底子有旺益上人并茂平安。"
      },
      {
        "年龄": "8-12岁",
        "男": "小童运度顺吉，各事伶俐，聪明可入学读书，定卜进步，水边小心，底子平安。",
        "女": "小女运度顺遂，如鱼化龙，各事活泼，旺益上人，但水边小心，吉星守命平安。"
      },
      {
        "年龄": "13-15岁",
        "男": "童造运度亨通，如鱼化龙，做事聪明，培养入学校读书，将来才学过人，小疾无妨平安。",
        "女": "玉造运度顺遂，技巧开窍，有旺益上人，三、五月水边小心，吉星照身平安。"
      },
      {
        "年龄": "16-17岁",
        "男": "祥造现年时令佳美，如鱼化龙，凡事聪明特达，三、五月虽有小疾无妨，贵人扶助出入平安。",
        "女": "玉造现年时令佳美，如鱼化龙，贤玉智慧，三、五月池井边小心，虽有小疾无妨，吉星守度平安。"
      },
      {
        "年龄": "18-29岁",
        "男": "英造步运亨通，如鱼化龙，凡事通能机智，但勿迫性，三、五月小疾无妨，贵人扶助可得财运平安。",
        "女": "玉造行运甚佳，如鱼化龙，性格柔和，五行清秀，有旺益家庭，三、五月虽有小疾无妨，出入平安。"
      },
      {
        "年龄": "30-55岁",
        "男": "乾造步运时令亨通，如鱼化龙，老练经济，春夏月戒忍口舌，幸贵人扶助，可得财喜平安。",
        "女": "坤造行运交泰，如鱼化龙，贤淑智慧，助益家庭，虽有暗疾无妨，吉星守度平安。"
      },
      {
        "年龄": "56-69岁",
        "男": "台造步运得此卦，如鱼化龙上吉，心地善良，但宜宽怀大量，春夏月小疾无妨，贵人扶助平安。",
        "女": "坤造现年时令佳美，签文如鱼化龙，性格温柔，内肋之德，虽有暗疾无至大害，吉星照身平安。"
      },
      {
        "年龄": "70岁以上",
        "男": "福造老运安康，忠诚老实，三、五月虽有灾疾无妨，贵人扶助，晚景胜前。",
        "女": "慈造老运，虽有旺益子孙，但防暗疾上身，三、五月守旧，幸吉星守命平安。"
      }
    ]
  },
  "生意": {
    "生意": "春夏财利小小来，逢上阳月路宏开，秋冬时节物涨价，生意经营得厚财。",
    "生意解曰": "生意可得厚财，但恐上春阻隔少利，宜刻苦经营五，九，十一月有贵人，生意兴隆",
    "开铺": "卜开铺之卦如鱼如龙之兆，春夏磨苦小利新开铺定有小阻，但要有胆智经营，秋冬月可得大财利。",
    "合伙": "卜合伙之卦如鱼化龙之兆，合之可成伙计宜同心同德，刻苦经营有贵人扶助，秋后有厚财利可也!",
    "置货": "置货春夏勿贪财，候于秋冬月，如鱼得水，有大财大利也。"
  },
  "出外": {
    "出外": "卜出外一事身体虽平安但有阻隔，可是应有胆智敢于前往，有贵人应心得想!"
  },
  "谋望求财": {
    "谋望": "先时一段报君知，秋后经营遂意时，若遇三阳开泰日，即知名利两相宜。",
    "谋望解曰": "谋事可成但防初时有阻隔，交秋冬有贵人扶助，所谋各事定能成功",
    "求财": "正财春夏秋小利，十月超至明年三阳日大吉利!"
  },
  "学艺功名": {
    "学艺": "卜学艺之卦，可以成功，君可择其吉日从师学习，宜刻苦用功，他日定能学得手艺随身也。",
    "功名": "功名得中，荣宗耀祖，成名大吉也。"
  },
  "行舟六畜": {
    "行舟": "行舟如意，顺风平安，但先苦后甜也。",
    "六畜": "春夏有阻家中猪，以后平安得大利。养牛有阻不可贪，神佛保佑灾害驱。",
    "猪羊": "",
    "草龙": "",
    "三鸟": "",
    "田蚕": ""
  },
  "移徙": {
    "移徙": ""
  },
  "行人": {
    "解曰": "",
    "签文": ""
  },
  "婚姻": {
    "解曰": "天配良缘水清鱼戏，情意相投,婚姻定可成功勿误时机",
    "签文": "天配良缘合两头，那堪相合更相谋，水清看见鱼游戏，好把丝纶下钓钩。"
  },
  "官讼": {
    "解曰": "",
    "签文": ""
  },
  "失物": {
    "解曰": "",
    "签文": ""
  },
  "占病": {
    "解曰": "",
    "签文": ""
  },
  "其他": {
    "灶君": "",
    "阳基": "",
    "六甲": "",
    "子息": "",
    "祖山": "",
    "青草": ""
  }
}