{
  "签号": "第四十一签",
  "签名": "姜承祖遇害",
  "签文类型": "螳螂捕蝉之兆",
  "卦象": "中平之卦",
  "生肖": "辰龙",
  "签文简介": {
    "戏文": "姜承祖从祖训，欲为圣朝除弄政，与民分忧，锐意改革，整朝纲，驱外侮。然正直之心多胸无城府，况虎狼当道，心狠手毒，为人君者，权重耳轻，而忠言义行，必异旧习。于是群奸每趁忠言有碍圣听，乘机奏列姜承祖罪状以触怒天颜，可怜姜承祖虽一腔义愤，也终为奸人所害。",
    "诗曰": "门前光出现，始见一皇天;心地行正道，经莲出水开。",
    "内兆": "落花流水"
  },
  "家宅运势": {
    "签文": "鬼怪无端入户庭，响声入梦怪人惊，要知因甚人财蹇，只因家庭路不平。",
    "解曰": "吉可得喜气但防夏秋月疾难失财口舌火厄，吓佛祖保平安，厝前受火烟杀冲伤，用八卦符安门上修整水道，祖上香灯拜到居住财丁兴旺。"
  },
  "岁君签": {
    "总诗": "落花流水两无情，家合惶惶主不宁，小中阴人招疾厄，须当急祷旺宗神。",
    "年龄运势": [
      {
        "年龄": "1-3岁",
        "男": "小孩根基虽足，但防二、五、九月灾疾波阻，六甲妇勿抱近抱，吓月娘化吉平安。",
        "女": "小女根苗浅薄，惟防二、五、九月六甲花水，夜时勿远出，吓月娘化吉平安。"
      },
      {
        "年龄": "4-7岁",
        "男": "小儿之卦运限未美，但防二、五、九月小疾水厄，凡水边小心，守旧，吓妈祖化吉平安。",
        "女": "小女现年运限未遂，二、五、九月惟防灾难水厄，逢水勿近，守旧，吓妈祖化吉平安。"
      },
      {
        "年龄": "8-12岁",
        "男": "小童运度未遂，虽伶俐，但防二、五、九月灾难水厄，逢水边小心，吓妈祖化吉平安。",
        "女": "小女之卦运度未遂，但防二、五、九月多生灾难水厄，吓妈祖化吉平安。"
      },
      {
        "年龄": "13-15岁",
        "男": "童造现年运度不吉，虽聪明，但防二、五、九月小疾水厄，水边小心，吓妈祖化吉平安。",
        "女": "玉造运度美中不足，二、五、九月尤防波阻，凡水边勿近，吓妈祖化吉平安。"
      },
      {
        "年龄": "16-17岁",
        "男": "祥造步运未遂，如乌云盖月，但防二、五、九月小灾波阻，宜守旧，多学文化，吓妈祖化吉保平安。",
        "女": "玉造现年运度美中不足，但防二、五、九月灾疾水厄，宜守旧，夜时勿远出，吓妈祖化吉平安。"
      },
      {
        "年龄": "18-29岁",
        "男": "乾造步运未遂，防二、五、九月小人口舌祸非，宜戒忍性气，方免造成落花流水，吓天地化吉平安。",
        "女": "玉造行运未遂，人虽技巧，但嫌美中不足，皆因签文落花流水，二、五、九月灾疾，吓天地化吉平安。"
      },
      {
        "年龄": "30-55岁",
        "男": "乾造步运未遂，签文乌云盖月，防二、五、九月小人不测之祸，凡事安分守己，吓天地化吉平安。",
        "女": "坤造行运，人虽贤惠，但嫌内心操杂，小人口舌，二、五、九月守旧，宜忍性，吓天地化吉平安。"
      },
      {
        "年龄": "56-69岁",
        "男": "台造步运不佳，如落花流水，人虽老练忠诚，但防二、五、九月平底风波，闲事勿理，底子平安。",
        "女": "坤造得此卦如落花流水，防暗疾多灾，二、五、九月守旧，忌看病人，底子平安。"
      },
      {
        "年龄": "70岁以上",
        "男": "台造老运不旺，虽为人正直，但防灾难交脱，二、五、九月守旧，忌入丧门则吉。",
        "女": "妇造老运不佳，惟防暗疾跌地之厄，早晚上落小心，二、五、九月守旧，底子平安。"
      }
    ]
  },
  "生意": {
    "生意": "意外之财不可寻，春夏有阻莫贪心，正财少利偏财失，慎防小人劫财金。",
    "生意解曰": "生意上春防阻失，防小人偷劫，宜守旧业，交易要直勿贪心，交冬可得财利",
    "开铺": "卜开铺之卦君心地宜公平正直，不可亏人勿惹口舌，勿积货防劫厄，宜求佛祖令旗合财帛星君镇铺宅。",
    "合伙": "卜合伙之卦如落花流水之兆，时令不吉勿合为要，若合之恐惹祸非盗劫失利!",
    "置货": "置货恐有阻失，防人暗算，要现买现卖，不可贪，若置之定失也。"
  },
  "出外": {
    "出外": "出外之卦美中不足防小人祸害，心中操杂，往之不成宜在家经营免生祸非!"
  },
  "谋望求财": {
    "谋望": "当初有意望东楼，既抵蓬来下九洲，不肯回头归去路，即交埋没入荒丘。",
    "谋望解曰": "谋事防人暗算，宜谨慎勿，防口舌失财之祸，心地宜从正道其事可成",
    "求财": "正财初时有阻防小人劫之，经营从正道交秋冬月转运，可得利，偏财莫取!"
  },
  "学艺功名": {
    "学艺": "卜学技艺之卦，如落花流水之兆，君时运未至，若学之，恐半途而废，不成也。",
    "功名": "功名不成，因时运未通，切勿进场，进不吉。"
  },
  "行舟六畜": {
    "行舟": "行舟有祸，不可行，行之失也。",
    "六畜": "今载六畜恐有残，要养切切心莫贪。猪牛鸡犬要防失，求祷伯公保平安。",
    "猪羊": "",
    "草龙": "",
    "三鸟": "",
    "田蚕": ""
  },
  "移徙": {
    "移徙": ""
  },
  "行人": {
    "解曰": "",
    "签文": ""
  },
  "婚姻": {
    "解曰": "此婚事不成，男求女不就，女求男莫恋，流水无情不能结合也",
    "签文": "休想斯人入汝家，莫教惆伥怨吁嗟，落花有意随流水，流水无情恋落花。"
  },
  "官讼": {
    "解曰": "",
    "签文": ""
  },
  "失物": {
    "解曰": "",
    "签文": ""
  },
  "占病": {
    "解曰": "",
    "签文": ""
  },
  "其他": {
    "灶君": "",
    "阳基": "",
    "六甲": "",
    "子息": "",
    "祖山": "",
    "青草": ""
  }
}