{
  "签号": "第三十五签",
  "签名": "刘皇叔过江招亲",
  "签文类型": "金雉衔赦之兆",
  "卦象": "上上之卦",
  "生肖": "戌狗",
  "签文简介": {
    "戏文": "周瑜欲拘人质，以讨还荆州，与孙权谋，计谋刘备过江招亲。孔明预将锦囊计付赵云，教先入吴宣扬孙、刘联婚事；相国寺相亲，复得孙国太庇护。新婚燕尔，刘备乐不思归，赵云又依孔明计，使刘备得计娶孙夫人过江。周瑜追截不及，赔了夫人又折兵，气极吐血。",
    "诗曰": "腰佩黄金印，身骑白玉麟;福人多宝物，玳瑁共珍珠。",
    "内兆": "金鸡报喜"
  },
  "家宅运势": {
    "签文": "檐前喜鹊叫三声，报汝今年百事成，官位日升财禄进，更依门户发光明。",
    "解曰": "家门喜气盈盈孕妇可产男儿，但嫌官非口舌失财灾火厄，是厝前受杀冲伤，宜求佛祖福灯吊门上祭化早晚火烛小心，居住财丁昌盛。"
  },
  "岁君签": {
    "总诗": "鸡鸣霄汉势冲天，万里程途任着鞭，官位自然财禄进，安居右庆庆时年。",
    "年龄运势": [
      {
        "年龄": "1-3岁",
        "男": "小儿根苗足养，八字清格，旺益上人，耐心培育，春夏月虽有小疾无妨，守命绵长。",
        "女": "小女根苗足旺，利益上人并茂，春夏月虽有小皮疾无妨，吉星守命出入平安。"
      },
      {
        "年龄": "4-7岁",
        "男": "小儿现年运限顺遂，生性活泼，有旺益上人，春夏月虽有小疾无妨，吉星守度平安。",
        "女": "小女之卦运限顺吉，各事精巧，春夏月有些皮肤小疾无至大害，吉星守度平安。"
      },
      {
        "年龄": "8-12岁",
        "男": "小童运度亨通，凡事伶俐活泼，宜培养入学读书，定卜进步，春夏月小疾无妨平安。",
        "女": "小女今年交上运，凡事技巧开窍，有旺益上人并茂，春夏月虽有小疾无妨平安。"
      },
      {
        "年龄": "13-15岁",
        "男": "童造现运顺遂，凡事聪明精通，宜入学读书，定卜前途进展，而且出入平安。",
        "女": "玉造现运交泰，如金鸡报喜，凡事精巧，旺益上人并茂，学习艺业玉体安康。"
      },
      {
        "年龄": "16-17岁",
        "男": "祥造步运亨通，如金鸡报喜，做事精通特达，多学手艺，春夏月小疾无妨，贵人扶助平安。",
        "女": "玉造行运甚美，如金鸡报喜，做事贤玉技巧，旺益家庭，春夏月虽有小疾无妨，吉星守度平安。"
      },
      {
        "年龄": "18-29岁",
        "男": "英造步运亨通，如金鸡报喜，年轻有为，前途进展有望，但勿迫性，贵人扶助，可得财喜平安。",
        "女": "玉造行运交上美景，如金鸡报喜，做事贤淑，旺益家庭，春夏月小疾无妨，吉星照身平安。"
      },
      {
        "年龄": "30-55岁",
        "男": "乾造步运交泰，如金鸡报喜，为人奇才特达，但勿迫性，幸有贵人扶助，可得财喜平安。",
        "女": "坤造行运亨通，如金鸡报喜，贤淑智慧，可称内助，小疾无妨，吉星守命可卜玉体安康。"
      },
      {
        "年龄": "56-69岁",
        "男": "台造步运佳美，如金鸡报喜，做事忠诚，胸怀宽宏，但勿迫性，有贵人扶助，可得财喜平安。",
        "女": "坤造行运亨通，如金鸡报喜，贤淑智慧，有内助之德，暗疾无妨，幸有吉星照身出入平安。"
      },
      {
        "年龄": "70岁以上",
        "男": "妇造老运得此卦，老当益壮，性直心慈，春夏月小疾无妨，贵人扶助晚景胜前。",
        "女": "慈造老运虽有旺益子孙，春夏月暗疾之厄，喜孝物勿食，幸吉星守命平安。"
      }
    ]
  },
  "生意": {
    "生意": "今年生意可稀奇，春夏似鸟落毛时，六月开始至秋冬，鸟添羽毛任高低。",
    "生意解曰": "春夏似鸟落毛生意阻隔，六月起至秋冬似海鹤添寿可大发展能得大利",
    "开铺": "卜开铺之卦上春有阻隔，防小人祸劫，六月起转运，金鸡报喜可得厚财大利。",
    "合伙": "卜合伙之卦大吉似金鸡报喜之兆，多人多福同心同德，协力经营可得大利。",
    "置货": "卜置货初时有阻，但宜立但智，敢于留货，至于秋后货物振价，可有大利。"
  },
  "出外": {
    "出外": "卜出外一事签文叶吉凡事勿疑要有胆智往于二，五月有贵人人重重也。"
  },
  "谋望求财": {
    "谋望": "几年松下惜羽毛，不肯低头皆富豪，有日夺身腾碧汉，方知志气此时高。",
    "谋望解曰": "谋事初时有小人阻隔，不可急候交秋冬事情便可成功也",
    "求财": "正财如鸟换毛，美在后来凡事宜立胆智前进，二八，十一月可得厚利，偏财初有阻，后有大利可得!"
  },
  "学艺功名": {
    "学艺": "卜学艺之卦，似金鸡报喜之兆，时运合课，宜求师学之，定能得手艺随身，为创业奠下良好基础。",
    "功名": "功名得中，荣宗耀祖，但要忍口舌是非。"
  },
  "行舟六畜": {
    "行舟": "行舟平安顺风得利，四方大吉。",
    "六畜": "六畜起初有阻临，不可怕之要用心。借得神力来保佑，到底定能得财金。",
    "猪羊": "",
    "草龙": "",
    "三鸟": "",
    "田蚕": ""
  },
  "移徙": {
    "移徙": ""
  },
  "行人": {
    "解曰": "",
    "签文": ""
  },
  "婚姻": {
    "解曰": "卜此婚事可成，不过初时有歹人说是非，但到底大吉可为长久相合之夫妻也",
    "签文": "瑶台仙鹤惯牺梧，月里嫦娥岂有夫，惟子欲求佳偶配，及今春色上皇都。"
  },
  "官讼": {
    "解曰": "",
    "签文": ""
  },
  "失物": {
    "解曰": "",
    "签文": ""
  },
  "占病": {
    "解曰": "",
    "签文": ""
  },
  "其他": {
    "灶君": "",
    "阳基": "",
    "六甲": "",
    "子息": "",
    "祖山": "",
    "青草": ""
  }
}