{
  "签号": "第十四签",
  "签名": "夏德海投文",
  "签文类型": "谋望时代之兆",
  "卦象": "中平之卦",
  "生肖": "未羊",
  "签文简介": {
    "戏文": "蔡端明母渡洛阳，遇风浪。时母腹怀端明，乃祷告上苍，若天使平安渡河，得产麟儿，必造桥以通人。告毕，风浪遂止。母平安归。后蔡端明中状元，乃偿母愿造桥，使家奴夏德投文东海龙王，求退潮。王允，桥告造成。",
    "诗曰": "物重须当力，黄幡因脚长;一帆风信转，消息报回乡。",
    "内兆": "龙蛇混杂"
  },
  "家宅运势": {
    "签文": "不宗香火不收身，未开家门伏祀神，若要财兴人口旺，除非安谢久家神。",
    "解曰": "吉宅人口可得喜气，但防三,四月疾难口舌，祸非失财皆因失祀祖上香灯，嫌灶君不旺，安祀祖上香灯，重做新灶吓佛祖保财丁兴旺。"
  },
  "岁君签": {
    "总诗": "龙蛇混杂最难分，未得风雷变化麟，一日腾云归北海，那时方得见龙津。",
    "年龄运势": [
      {
        "年龄": "1-3岁",
        "男": "小孩根苗虽足，但防三、四、六月灾难波阻，吓吴爷化吉，交秋返运平安。",
        "女": "小女根基浅薄，但防三、四、六月小疾多事，吓月娘化吉，交秋返运平安。"
      },
      {
        "年龄": "4-7岁",
        "男": "小儿之卦时令未美，惟防三、四、六月小疾，汤火之厄，吓吴爷，交秋返运平安。",
        "女": "小女运限未美，惟防三、四、六月灾难，汤火小心，吓吴爷化吉，交秋返运平安。"
      },
      {
        "年龄": "8-12岁",
        "男": "小儿运度未美，虽天真，防三、四、六月灾难波阻，吓吴爷化吉，交秋返运平安。",
        "女": "小女现年运限未美，虽天真，防三、四、六月脚手痛疾，吓天地化吉，吓天地化吉，交秋返运平安。"
      },
      {
        "年龄": "13-15岁",
        "男": "童造今年运度不美，惟防三、四、六月灾难波阻，勿执己僻，吓吴爷化吉，交秋返运平安。",
        "女": "玉造现年运度未遂，但防三、四、六月小疾，汤火之厄，宜小心，吓吴爷化吉，交秋返运，出入平安。"
      },
      {
        "年龄": "16-17岁",
        "男": "祥造步运未美，龙蛇混杂，防三、四、六月小疾多灾，守旧，学习文化，吓吴爷化吉，交秋转运平安。",
        "女": "玉造人虽贤玉，但嫌自执己意，又防三、四、六月灾难，夜时勿外出，吓月娘化吉，交秋步入佳景。"
      },
      {
        "年龄": "18-29岁",
        "男": "英造步运未美，龙蛇混杂，虽有智慧，但防三、四、六月口舌祸非，凡事戒忍，吓吴爷交秋转运可得财喜。",
        "女": "玉造人虽贤玉，但美中不足，龙蛇混杂，但防三、四、六月小疾波阻，夜时东西方勿往，吓吴爷化吉平安。"
      },
      {
        "年龄": "30-55岁",
        "男": "乾造步运未美，龙蛇混杂，防三、四、六月灾难祸非，宜戒性，吓天地，交秋转运，可得财喜平安。",
        "女": "坤造行运未美，人虽清秀，但嫌心内迫杂，凡事温柔忍性，三、四、六月守旧，吓吴爷化吉方保平安。"
      },
      {
        "年龄": "56-69岁",
        "男": "台造步运不美，似龙蛇混杂，人虽忠厚，但防三、四、六月不测之祸，凡事宽怀大量，闲事勿理，交秋平安。",
        "女": "坤造行运虽有助益家庭，但嫌操心暗疾，凡事吞忍，三、四、六月守旧，忌看病人，吓天地保平安。"
      },
      {
        "年龄": "70岁以上",
        "男": "福造老运不旺，诚恐交脱，早晚上落小心，忌入丧门，三、四、六月守旧，交秋大造平安。",
        "女": "妇造老运不旺，老风暗疾，凡事静养，忌看病人，三、四、六月守旧，交秋福体安康。"
      }
    ]
  },
  "生意": {
    "生意": "生意欲做有偏财，购货恐防假不知，货物不可多留久，守旧经营利路开。",
    "生意解曰": "生意欲做要守旧经营，防三，四月小人拐骗累害，交易欲认真谨慎秋后可得财利。",
    "开铺": "卜开铺之卦宜守旧经营防歹人拐骗，以假弄真购买货物谨慎秋后有财利也。",
    "合伙": "卜合伙之卦似龙蛇混杂之兆，恐伙计不同心口舌是非多，勿合免失财利也!",
    "置货": "卜置货物初时可有得利，但防日后阻失，所置之货不可久留，应快速发售也。"
  },
  "出外": {
    "出外": "卜出外一事龙蛇混杂内中有事物阻隔，做事勿三心二意，宜守旧经营则安然。"
  },
  "谋望求财": {
    "谋望": "两头事务尚蹉跎，见好因循本分过，自谋得来不长久，眼前求得也清磨。",
    "谋望解曰": "卜谋事初时有阻隔，宜用劳力心处理之可以成功，但恐不久吓神明保佑也",
    "求财": "正财虽是有得但不安稳，恐阻失宜立志刻苦经营，秋后有财利可得，偏财可取但应忍口舌!"
  },
  "学艺功名": {
    "学艺": "卜学技艺之卦，恐君三心两意，不定主意，难以学得手艺，候秋后择吉日从师，则可成功。",
    "功名": "功名难得，若中之也，恐寿不久也。"
  },
  "行舟六畜": {
    "行舟": "行舟有阻，不吉不安，不可出行。",
    "六畜": "六畜有阻猪牛羊，饲养恐防不吉祥。切切不可贪多养，精心勤养少财钱。",
    "猪羊": "",
    "草龙": "",
    "三鸟": "",
    "田蚕": ""
  },
  "移徙": {
    "移徙": ""
  },
  "行人": {
    "诗": "",
    "解曰": ""
  },
  "婚姻": {
    "婚姻": "婚姻不与众人知，失却伦常邂逅迟，若不被人强占害，亦遭官府受鞭苔。",
    "解曰": "婚姻不成恐被人占害，若成这恐不合或合之不久，且惹是非也"
  },
  "官讼": {
    "官讼": "",
    "解曰": ""
  },
  "失物": {
    "失物": "",
    "解曰": ""
  },
  "占病": {
    "占病": "",
    "解曰": ""
  },
  "其他": {
    "灶君": "",
    "阳基": "",
    "六甲": "",
    "子息": "",
    "祖山": "",
    "青草": ""
  }
}