{
  "签号": "第四十五签",
  "签名": "罗成娶妻",
  "签文类型": "蟾宫折桂之兆",
  "卦象": "上上之卦",
  "生肖": "子鼠",
  "签文简介": {
    "戏文": "唐程咬金代罗成议定一门亲事，罗成不就，其未婚妻美淑且多情，因羡罗成英武，终相思而亡。程咬金愤极，蓄意惩罚罗成，骗其为娶美姿娘，实乃替娶丑史大奈。迎娶路上，史大奈暴王，罗成前期魂附丑女身复活，丰颜姣好如旧，终了旧愿，与罗成遂百年欢好。",
    "诗曰": "一鸟庭前立，胜如争在先;深潭垂钓饵，得鲤任君才。",
    "内兆": "万物萌芽"
  },
  "家宅运势": {
    "签文": "门冷户衰百怪生，人财两散梦魂惊，如今君问平安日，庶民人口进财丁。",
    "解曰": "人财冲冠防疾难破财是非火盗，男女不和兄弟分居宜求佛祖保平安，又嫌门字灶君分金不美，宜修改合课居住财丁昌盛。"
  },
  "岁君签": {
    "总诗": "风雷鼓舞播乾坤，万物萌芽尽发生，如今君问平安日，待至秋冷月又明。",
    "年龄运势": [
      {
        "年龄": "1-3岁",
        "男": "小孩根基足养，但防春夏月灾难波阻，宜吓月娘化吉，交秋返运出入平安。（以诗文为准）",
        "女": "小女根苗浅薄，惟防春夏月小疾多事，宜吓月娘化吉，交秋返运出入平安。（以诗文为准）"
      },
      {
        "年龄": "4-7岁",
        "男": "小儿现年运限未遂，虽精通，但防春夏月多生波阻，水边小心，吓月娘，交秋返运平安。（以诗文为准）",
        "女": "小女运限未美，惟防春夏月灾难水厄，逢水边小心，吓月娘化吉，交秋返运平安。（以诗文为准）"
      },
      {
        "年龄": "8-12岁",
        "男": "小儿之卦时令未美，春夏月尤防小疾多事，吓月娘化吉，交秋转运平安。（以诗文为准）",
        "女": "小女运度未佳，惟防执僻，又防小疾波阻，春夏月守旧，吓月娘化吉，交秋返运平安。（以诗文为准）"
      },
      {
        "年龄": "13-15岁",
        "男": "童造时令未佳，不可执僻，春夏月皮肤小疾，守旧，吓月娘，交秋返运平安。（以诗文为准）",
        "女": "小女时运不佳，人虽清秀，但防春夏月波阻，夜勿独行，吓月娘交秋返运平安。（以诗文为准）"
      },
      {
        "年龄": "16-17岁",
        "男": "祥造运度未美，人虽聪明特达，但防二、四、六月小疾波阻，吓天地化吉，交秋返运平安。（以诗文为准）",
        "女": "玉造时令未佳，人虽贤玉，惟防波阻，春夏月切勿独行，吓月娘，交秋返运平安。（以诗文为准）"
      },
      {
        "年龄": "18-29岁",
        "男": "英造步运不佳，万物萌芽虽特达，但防春夏月小人祸非，不可迫性，交秋贵人扶助，可得财喜平安。（以诗文为准）",
        "女": "美造现年时运不佳，虽是贤淑，但防小疾多事，春夏月守旧，夜时勿远出独行，交秋转运出入平安。（以诗文为准）"
      },
      {
        "年龄": "30-55岁",
        "男": "乾造步运未美，人虽老练，但嫌迫性，春夏月防小人嫁祸，凡事从正，交秋转运有贵人扶助平安。（以诗文为准）",
        "女": "坤造行运不美，虽助益家庭，但防暗疾口舌，凡事忍住，吓月娘，交秋平安。（以诗文为准）"
      },
      {
        "年龄": "56-69岁",
        "男": "台造步运不美，虽忠诚，惟防春夏月灾难，歹人不测之祸，闲事切勿近理，交秋转运平安。（以诗文为准）",
        "女": "坤造现年运度美中不足，虽有内助之称，但嫌操心暗疾，春夏月守旧，交秋平安。（以诗文为准）"
      },
      {
        "年龄": "70岁以上",
        "男": "吉造老运不旺，但嫌人老迫性，防春夏月交脱，上落小心，守旧，交秋平安。（以诗文为准）",
        "女": "妇造老运不旺，但防暗疾跌地之厄，守旧，喜孝堂勿近，交秋可卜大造平安。（以诗文为准）"
      }
    ]
  },
  "生意": {
    "生意": "凡事通灵营生意，春夏似月云遮去，秋冬贵人相扶助，借力谋财好局势。",
    "生意解曰": "按旧来经营恐吓有阻失，要创新业防初时亏本，要和人合伙移他人福，可得厚财",
    "开铺": "卜开铺之卦得鲤鱼，看君的才能，上春恐吓有阻失，秋后有贵人扶助，能上蟾宫折桂，可得厚财利。",
    "合伙": "卜合伙之卦叶吉如万物逢春之兆，宜同心同德协力经营，秋后可得厚财利也!",
    "置货": "卜今年置货，上春防亏本，但要立胆智置而留之，候交秋冬月，可得财利。"
  },
  "出外": {
    "出外": "卜出外一事签文虽安然，但嫌心意未定，要有胆智敢往，五八月有贵人重重。"
  },
  "谋望求财": {
    "谋望": "本是聪明特达人，恰似明月云遮清，等闲借得东风力，吹去浮云又复明。",
    "谋望解曰": "谋事初时时运未通，防小人阻隔，但又有贵人重重，交三，五月成就，肖牛者更妙",
    "求财": "正财上春利薄宜立志气维持秋后转运有厚利可得，偏财要托他人之福，要忍口舌是非!"
  },
  "学艺功名": {
    "学艺": "卜学技艺之卦叶吉，但君须勤学苦练，定能得名师传真艺，掌握技艺本领，肖牛者学之更妙。",
    "功名": "文武皆及第，荣宗耀祖，捐纳及营伍有纳升。"
  },
  "行舟六畜": {
    "行舟": "行舟顺风得利，春夏中吉，秋冬大利大吉。",
    "六畜": "初有小阻不必疑，借得神力魔可驱。莫听旁人东西说，月圆秋交有大利。",
    "猪羊": "",
    "草龙": "",
    "三鸟": "",
    "田蚕": ""
  },
  "移徙": {
    "移徙": ""
  },
  "行人": {
    "解曰": "",
    "签文": ""
  },
  "婚姻": {
    "解曰": "虽有一对好姻缘，但有小人破说，不要乱听闲言宜速定配，成之大吉",
    "签文": "本来婚姻要团圆，无奈旁人说乱言，迟定不如早定好，管教男女共完全。"
  },
  "官讼": {
    "解曰": "",
    "签文": ""
  },
  "失物": {
    "解曰": "",
    "签文": ""
  },
  "占病": {
    "解曰": "",
    "签文": ""
  },
  "其他": {
    "灶君": "",
    "阳基": "",
    "六甲": "",
    "子息": "",
    "祖山": "",
    "青草": ""
  }
}