{
  "签号": "第十七签",
  "签名": "王省就亲",
  "签文类型": "一牛二尾之兆",
  "卦象": "中平之卦",
  "生肖": "辰龙",
  "签文简介": {
    "戏文": "恶少番奉欲霸余三姑为妻。三姑随夫王省避居姑母家中。表兄秦招吉贪三姑色，醉王省，冒报王省名，夜敲三姑居室相戏，欲乱之时适番奉使白面虎寻杀王省，秦乃被错杀，王遂坐罪。幸包公查访重审，案情始大白。",
    "诗曰": "才子遇佳人，红霞映碧波;文书今日至，凡事起荣华。",
    "内兆": "枯树生枝"
  },
  "家宅运势": {
    "签文": "莫将怪梦作闲因，邪摩私祸不临神，自是行藏千里合，岂因病小危难消。",
    "解曰": "吉宅人口可得喜气临门，但嫌六杀占宅，恐吓防六，九，十二月疾难口舌失财，向佛祖奉经保平安，求达摩祖师香火安门上祭化则财丁兴旺。"
  },
  "岁君签": {
    "总诗": "当时得意反成痴，今日忧疑事不危，若遇贵人相接引，十年桔树又生枝。",
    "年龄运势": [
      {
        "年龄": "1-3岁",
        "男": "小孩根苗足养，惟有春夏月小疾，守旧，幸吉星守度，寿命绵长平安。",
        "女": "小女根苗足养，旺益上人并茂，夏月小疾无妨，吉星守度平安。"
      },
      {
        "年龄": "4-7岁",
        "男": "小儿运限顺遂，生性天真，旺益上人并茂，春夏月小疾无妨，寿命绵长。",
        "女": "小女运限叶吉，天真活泼，利益上人春夏月小疾无妨，吉星守度平安。"
      },
      {
        "年龄": "8-12岁",
        "男": "童造运度顺遂，各事开窍，宜培养入学读书，定卜进步，吉星守命出入平安。",
        "女": "小女运度叶吉，各事伶俐，旺益上人并茂，夏月小疾无妨，吉星守度出入平安。"
      },
      {
        "年龄": "13-15岁",
        "男": "童造今年交上运，聪明开窍，宜入学读书，定卜远景有望，且出入平安。",
        "女": "玉造现年交上美运，旺益家门，夏月虽有小疾无妨，有吉星照身平安。"
      },
      {
        "年龄": "16-17岁",
        "男": "祥造时运亨通，如枯木生枝，各事通能，认真学习文化，前途进展，出入平安。",
        "女": "玉造交上美运，技巧清秀，有助益家庭之心，夏月虽有小疾无妨，出入平安。"
      },
      {
        "年龄": "18-29岁",
        "男": "英造步运亨通，如枯木生枝，做事有奇才机智，但凡事从正道经营，意外勿贪，有贵人扶助可得财喜。",
        "女": "玉造今年交上美运，步入佳景，宜习收益，春夏月虽有小疾无妨，卦中吉星照身出入平安。"
      },
      {
        "年龄": "30-55岁",
        "男": "乾造步运亨通，如枯木生枝，聪明奇智，宜从正道，为人义气相交，切勿妄取，有贵人扶助可得财喜。",
        "女": "坤造行运交泰，如枯木生枝，贤淑智慧，有内助之称，但勿操迫，暗疾无妨，幸吉星守度出入平安。"
      },
      {
        "年龄": "56-69岁",
        "男": "台造步运亨通，如枯木生枝，做事忠诚，但宜宽宏大量，春夏月虽有小疾无妨，贵人扶助出入平安。",
        "女": "坤造行运交泰，如枯木生枝，虽有旺益家庭，但防暗疾之阻，宜静养，幸有吉星照身出入平安。"
      },
      {
        "年龄": "70岁以上",
        "男": "吉造老运安康，但防春夏灾疾之厄，守旧，幸贵人扶助，晚景胜前。",
        "女": "妇造老运虽有旺益子孙，但暗疾上身，忌看病人，幸吉星守命平安。"
      }
    ]
  },
  "生意": {
    "生意": "生意经营切莫贪，牢牢记住守旧框，肖牛之人防阻失，肖羊之人厚利攀。",
    "生意解曰": "生意有利可得但防阻失，经营要正直谨慎，肖羊者得厚利，肖牛者失财利",
    "开铺": "卜开铺之卦不美未开勿开，已开之钥应防盗贼火灾，肖牛者失利肖羊者可得大利。",
    "合伙": "卜合伙之卦不美失字当头，特别是肖牛者更不妙，伙计不同心有小人祸害，勿合也!",
    "置货": "卜置货物，肖牛之人定失，肖羊之人能得利，余生肖者不可贪财利则吉也。"
  },
  "出外": {
    "出外": "卜出外一事虽有贵人扶助，但又防小人生端寄祸，不可在外久住，且来来往往!"
  },
  "谋望求财": {
    "谋望": "贪多更惹祸临身，名利从来是未真，但得忧游家道乐，知他谁是百年人。",
    "谋望解曰": "谋事可成但有阻隔，做要稳重认真，不可贪心方免惹祸临身",
    "求财": "正财库取利虽有微利可得，但恐防阻失，凡事业从正道，八，十一月有财利可得，偏财有阻失勿取吉也!"
  },
  "学艺功名": {
    "学艺": "学技艺之卦，肖羊者学之定成，肖牛者勿学为宜，其他人学习，宜刻苦用工，可成功也。",
    "功名": "功名肖羊之人及未科，定可显达也。"
  },
  "行舟六畜": {
    "行舟": "行舟中吉，防凶失，合移不可也。",
    "六畜": "耕牛阻隔在今年，养猪劳苦有一期。肥猪养大及时卖，放羊牧人得财利。",
    "猪羊": "",
    "草龙": "",
    "三鸟": "",
    "田蚕": ""
  },
  "移徙": {
    "移徙": ""
  },
  "行人": {
    "解曰": "",
    "签文": ""
  },
  "婚姻": {
    "解曰": "婚姻大事切需要探明对方底细，不可马虎从事乱挥金钱，别把野花当红花",
    "签文": "不须勉强费尽金，婚来合时何用寻，立志强成非好事，知人知面不知心。"
  },
  "官讼": {
    "解曰": "",
    "签文": ""
  },
  "失物": {
    "解曰": "",
    "签文": ""
  },
  "占病": {
    "解曰": "",
    "签文": ""
  },
  "其他": {
    "灶君": "",
    "阳基": "",
    "六甲": "",
    "子息": "",
    "祖山": "",
    "青草": ""
  }
}