{
  "签号": "第十三签",
  "签名": "吕蒙正两世姻缘",
  "签文类型": "万物逢春之兆",
  "卦象": "大吉之卦",
  "生肖": "申猴",
  "签文简介": {
    "戏文": "吕蒙正前期刘氏守寒窑受虐而亡，转世为渔翁女，丽色而拳手不开。吕呼之，其掌顿开，渔翁女乃嫁吕，生子吕子骞，骞生孙亦贤。俱登科。",
    "诗曰": "禹门跳浪翻，鱼变化为龙;已意成君意，方为吉亨通。",
    "内兆": "脱衣换锦"
  },
  "家宅运势": {
    "签文": "今年不似去年贫，财禄重添遇贵宾，人口完成无盗贼，平安赛过九洲人。",
    "解曰": "喜气洋洋，但防疾难口舌失财盗贼之厄，门户小心皆因祖山不顺，有利宜修整合课，吓佛祖保平安，并求福灯吊门上化吉，则财丁可兴旺也。"
  },
  "岁君签": {
    "总诗": "开花结果喜逢时，赖得天官造化机，谋望求财皆遂意，衣锦还乡事可期。",
    "年龄运势": [
      {
        "年龄": "1-3岁",
        "男": "小孩根基足养，八字清秀，旺益上人并茂，上春月虽有小疾无妨，吉星守命平安。",
        "女": "小女根苗稳固，有旺益上人并茂，上春月虽有皮疾无妨，卦中吉星守命平安。"
      },
      {
        "年龄": "4-7岁",
        "男": "小儿现年亨通，天真活泼，利益上人并茂，夏月水边小心，吉星守度平安。",
        "女": "小女运限顺遂，各事伶俐，旺益上人并茂，夏月水边小心，幸吉星守命平安。"
      },
      {
        "年龄": "8-12岁",
        "男": "童造现年运度叶吉，天真伶俐，可入学校读书，定卜进行，夏月水边小心，幸吉星守命平安。",
        "女": "小女之卦时令亨通，各事活泼，有旺益上人并茂，夏月虽有小疾无妨，吉星守度平安。"
      },
      {
        "年龄": "13-15岁",
        "男": "童造运度精通，各事聪明开窍，宜培养入学校读书，定卜进步，出入平安。",
        "女": "玉造运度顺遂，活泼精巧，上春月虽有小疾无妨，吉星守命出入平安。"
      },
      {
        "年龄": "16-17岁",
        "男": "吉造现年运度亨通，如鱼化龙，聪明才干，培养入学，远景有望，而且出入平安。",
        "女": "玉造今年交上美运，如鱼化龙，助益家庭，虽有小疾无妨，吉星守度平安。"
      },
      {
        "年龄": "18-29岁",
        "男": "英造步运亨通，如鱼化龙，通能才干，可向外争取，上春月虽有小疾无妨，有贵人扶助，可得财喜平安。",
        "女": "坤造行运交泰，如鱼化龙，贤玉技巧，有助益家庭之心，上春月小疾无妨，吉星守度玉体安康也。"
      },
      {
        "年龄": "30-55岁",
        "男": "乾造步运亨通，如鱼化龙，为人才能特达，向外从正发展，有贵人扶助，可得财喜，但勿迫性平安。",
        "女": "坤造行运交佳，如鱼化龙，贤惠有内助之称，虽有些小安吉无妨，卦中吉星守命平安。"
      },
      {
        "年龄": "56-69岁",
        "男": "台造步运顺遂，为人忠诚，君家之卦如鱼化龙，上春月虽有小疾无至大害，有贵人扶助可得财运平安。",
        "女": "坤造行运亨通，可称内助，但有小暗疾无妨，忌看病人，喜孝物勿进，幸吉星守度平安。"
      },
      {
        "年龄": "70岁以上",
        "男": "福造老运得此卦太旺，虽有旺益子孙，但防灾疾跌地之厄，上春月守旧，幸贵人扶助晚景胜前平安。",
        "女": "妇造老运安康，旺益子孙，但防暗疾多灾，上春月喜孝物勿食，宜守旧，幸吉星守命，老福绵长。"
      }
    ]
  },
  "生意": {
    "生意": "市场货物能购收，精心保管把货留，莫怕初时有阻败，秋至价高利倍售。",
    "生意解曰": "生意之卦初时财利稀少，但与人交易宜立志坚持候五，九，十一月可得厚财利。",
    "开铺": "卜开铺之卦宜秋后开业可一帆风顺得财利，若春夏月开业，宜请佛祖符令贴门上化吉也。",
    "合伙": "卜合伙之卦大吉伙计宜同心同德协力经营，候交秋冬月可得大财利也。",
    "置货": "置货起初价不振，宜放心存留，候交秋月，货物定有振价，可得财利也。"
  },
  "出外": {
    "出外": "卜此出外之卦，各事亨通，有贵人扶助，应于三、五、九月往外，定有厚财利可得。"
  },
  "谋望求财": {
    "谋望": "玉体冰肌不可移，真心之有寒岁知，如今喜得阳和日，花落自然中满枝。",
    "谋望解曰": "谋事有贵人扶助，交秋月可定就，但不能三心二意应一心一意，认真谋之",
    "求财": "正财上半年稀少宜守旧刻苦经营，交五，六，十一月财利亨通，可得厚财大利，偏财初有阻隔后可得，但切须忍口舌!"
  },
  "学艺功名": {
    "学艺": "卜学艺之卦，时令合局，有贵人扶助，宜决心立志，寻得名师传艺也。",
    "功名": "功名中，衣锦荣归，若九月赴试定显达。"
  },
  "行舟六畜": {
    "行舟": "行舟先难后易，秋后出船大吉。",
    "六畜": "要问家中猪牛羊，精心饲养多吉祥。祈祷神明力保佑，猪肥牛壮财利长。",
    "猪羊": "",
    "草龙": "",
    "三鸟": "",
    "田蚕": ""
  },
  "移徙": {
    "移徙": ""
  },
  "行人": {
    "诗": "",
    "解曰": ""
  },
  "婚姻": {
    "婚姻": "才郎女貌世间稀，前缘配定不须疑，如今但愿他人准，好把聘财去定期。",
    "解曰": "郎才女貌前缘配定，美满婚姻应及早托人前往说定，定期上聘勿失良机出外;一事名事亨通有贵人扶助，应于三，五，九月往外定有厚财利可得!"
  },
  "官讼": {
    "官讼": "",
    "解曰": ""
  },
  "失物": {
    "失物": "",
    "解曰": ""
  },
  "占病": {
    "占病": "",
    "解曰": ""
  },
  "其他": {
    "灶君": "",
    "阳基": "",
    "六甲": "",
    "子息": "",
    "祖山": "",
    "青草": ""
  }
}