{
  "签号": "第二十一签",
  "签名": "上帝收龟精",
  "签文类型": "鸾凤冲霄之兆",
  "卦象": "大吉之卦",
  "生肖": "子鼠",
  "签文简介": {
    "戏文": "玄天上帝修九世功德，始成正果。偶尔外出，路遇一肉牛，赞其肥美，以其心美之而犯戒遂反胃，呕出肚肠，化为龟蛇。龟蛇祸害地方，作苦百姓，玉帝察知，乃令上帝收伏龟蛇，镇于足下。",
    "诗曰": "一人持一笔，逢午壬龙飞;守园平地稳，得意上云梯。",
    "内兆": "如鲲化鹏"
  },
  "家宅运势": {
    "签文": "须宜另改旧门庭，人旺财兴百事宁，不但田蚕收十倍，更随四方任经营。",
    "解曰": "吉宅可得喜气盈门，如无喜气事就恐有孝服事到来，皆因门字分金不正门庭水字不美，宜修整改正门庭分金水字求佛祖福灯吊正门上化吉保平安。"
  },
  "岁君签": {
    "总诗": "鲲化为鹏海浪翻，阴阳交泰太平关，庶人暮有凌云志，平地雷声倚势还。",
    "年龄运势": [
      {
        "年龄": "1-3岁",
        "男": "小孩根苗足养，旺益上人并茂，正、三、五月小疾无妨，吉星守度寿命绵长。",
        "女": "小女根苗稳固，旺益上人，正、三、五月小波疾无妨，吉星守命平安。"
      },
      {
        "年龄": "4-7岁",
        "男": "小儿之卦生性天真，旺益上人，正、三、五月不可登高，小疾无妨，吉星守度平安。",
        "女": "小女运限顺遂，旺益上人，不可登高，正、三、五月守旧，小疾无妨，有吉星照身出入平安。"
      },
      {
        "年龄": "8-12岁",
        "男": "小儿运度叶吉，各事精通，培养入学，不可登高，幸吉星照身，前途有望，平安无事。",
        "女": "小女运限亨通，凡事活泼，有旺益上人并茂，虽有小疾无妨，吉星守命平安。"
      },
      {
        "年龄": "13-15岁",
        "男": "小童运度叶吉，聪明伶俐，宜入学校读书，定卜进步，远景有望，出入平安。",
        "女": "小女运度顺遂，伶俐开窍，宜习手艺，正、三、五月小疾无妨，吉星守度平安。"
      },
      {
        "年龄": "16-17岁",
        "男": "祥造步运亨通，聪明开窍，培养入学，定卜前途进展，出入平安。",
        "女": "玉造今年交上美运，技巧开明，助益家门，正、三、五月小疾无妨，玉体安康。"
      },
      {
        "年龄": "18-29岁",
        "男": "英造步运亨通，如鲲化鹏，时令特达，但勿迫性，从正发展，有贵人扶助，可得财喜，出入平安。",
        "女": "玉造行运交泰，如鲲化鹏，各事贤玉，虽有旺益家庭，但宜温柔忍性，出入平安。"
      },
      {
        "年龄": "30-55岁",
        "男": "乾造步运亨通，人虽奇才，但防正、三、五月小人平地风波，凡事戒忍，幸贵人扶助，可得财喜平安。",
        "女": "坤造行运甚佳，如鲲化鹏，但勿迫切，温柔大量，虽有小疾无妨，吉星守命可卜出入平安。"
      },
      {
        "年龄": "56-69岁",
        "男": "台造步运亨通，为人心直性迫，凡事宽怀大量，防有不测风波，幸贵人扶助出入平安。",
        "女": "坤造行运交泰，各事贤惠，但防暗疾口舌，凡事吞忍守旧，幸有吉星守度平安。"
      },
      {
        "年龄": "70岁以上",
        "男": "福造老运得此卦太旺，惟防灾难跌地之厄，早晚上落小心，幸贵人扶助平安。",
        "女": "妇造老运不旺，暗疾上身，正、三、五月守旧，喜孝物勿进，幸吉星守度平安。"
      }
    ]
  },
  "生意": {
    "生意": "生意求财要有义，偏财一点不得利，肖马之人偏财得，四面八方任行时。",
    "生意解曰": "春季生意不能得利候五，六月起似龙带雨定有财源广进，惟肖马者有偏财可得谋望;几年沉落波涛内，未得风雷志气高，今日脱身多变化，应知万里任游遨，谋事有成但防时有阻隔，用心窍候六，九月可成，但肖猴者恐惹官非失财",
    "开铺": "卜开铺卜开铺之卦叶吉，初小利宜壮胆经营交五，六月起如鱼化鹏，可得厚财利也。",
    "合伙": "卜合伙之卦大吉，但伙计要有仁义，要同心协力交五，六月起财源广进可得财利!",
    "置货": "卜置货初时有惊阻，到底渐渐亨通，应于五、六、七、八月定得大利也。"
  },
  "出外": {
    "出外": "卜出外之卦叶吉有贵人扶助可于三，五月往外有厚利可得各事平安!"
  },
  "谋望求财": {
    "谋望": "几年沉落波涛内，未得风雷志气高。今日脱身多变化，应知万里任遨游。",
    "谋望解曰": "谋事有成，但防时有阻隔，用心窍，候六、九月可成，但肖猴者恐惹官非失财。",
    "求财": "正财库取利上春财利稀少，但宜刻苦经营秋厚转运，各事亨通可得厚利偏财唯肖马羊者得之!"
  },
  "学艺功名": {
    "学艺": "卜学艺之卦叶吉，按签文上春恐有阻隔，宜秋后学之，定能成功，手艺随身也。",
    "功名": "功名成也，肖牛羊之人逢午未更能显达。"
  },
  "行舟六畜": {
    "行舟": "行舟初时不顺，后来行之，顺风得利。",
    "六畜": "六畜有阻在春光，求神拜佛保平安。猪羊兴旺秋月后，快肥快大人乐观。",
    "猪羊": "",
    "草龙": "",
    "三鸟": "",
    "田蚕": ""
  },
  "移徙": {
    "移徙": ""
  },
  "行人": {
    "解曰": "",
    "签文": ""
  },
  "婚姻": {
    "解曰": "精男巧女配合大吉，但要速速下聘办理，不可拖延，若迟恐祸变也",
    "签文": "精男巧女两相当，配合婚姻启后昌，此际好求鸾风偶，迟延悔过费思量。"
  },
  "官讼": {
    "解曰": "",
    "签文": ""
  },
  "失物": {
    "解曰": "",
    "签文": ""
  },
  "占病": {
    "解曰": "",
    "签文": ""
  },
  "其他": {
    "灶君": "",
    "阳基": "",
    "六甲": "",
    "子息": "",
    "祖山": "",
    "青草": ""
  }
}