{
  "签号": "第十一签",
  "签名": "武吉卖柴",
  "签文类型": "久病逢医之兆",
  "卦象": "大吉之卦",
  "生肖": "戌狗",
  "签文简介": {
    "戏文": "武吉将入市，姜尚劝勿往，言必伤人命。武吉挑柴市卖，遇文王车架，忙避之，人担误毙门官王相，文王命画地为牢，竖木为吏囚之。武吉思母，恸。散宜生奏上允其先回家事母，然后归偿命。后武吉因引见姜尚，文王免其罪，并封为武德将军。",
    "诗曰": "红日当天照，光辉遍四方;西川人着锦，红紫满长春。",
    "内兆": "如日之升"
  },
  "家宅运势": {
    "签文": "家旺人兴百事宜，田蚕加倍在秋期，但防阴人生疾病，见喜消灾事可知。",
    "解曰": "吉宅人口可得喜气，但防疾难口舌涉财，是厝内有神恩土德，宜择日改谢清楚，又嫌祖山不顺有利宜修整壮旺，可得财丁兴旺。"
  },
  "岁君签": {
    "总诗": "囚人出狱公事休，却买甜瓜上酒楼，偶遇故人同畅饮，酒钱不了义相绕。",
    "年龄运势": [
      {
        "年龄": "1-3岁",
        "男": "小孩根苗足养，八字清格，旺益上人，上春月小疾无妨，吉星守岁平安。",
        "女": "小女根苗足养，夏月虽有小皮疾无妨，卦中有吉星守命，出入平安。"
      },
      {
        "年龄": "4-7岁",
        "男": "小儿之卦叶吉，生性天真活泼，旺益上人并茂，春夏月小疾无妨，出入平安。",
        "女": "小女之卦顺遂，各事伶俐活泼，旺益上人并茂，春夏月小疾无妨，出入平安。"
      },
      {
        "年龄": "8-12岁",
        "男": "童造现年交上运，各事开窍，宜培养入学读书，定卜进步，而且出入平安。",
        "女": "玉造现年运度顺遂，技巧活泼，春夏月虽有小波阻无妨，吉星守命平安。"
      },
      {
        "年龄": "13-15岁",
        "男": "童造运度亨通，聪明开窍，宜入学读书，定卜前途有望，出入平安。",
        "女": "玉造现年交上美运，如月之明，技巧伶俐，春夏月虽有小疾无妨，吉星守命平安。"
      },
      {
        "年龄": "16-17岁",
        "男": "吉造步运亨通，如日东升，做事聪明，培养入学，贵人扶助，小疾无妨平安。",
        "女": "玉造今年交上美运，如月之明，技巧贤玉，春夏月小疾无妨，吉星守命平安。"
      },
      {
        "年龄": "18-29岁",
        "男": "英造步运亨通，如日东升，奇才特达，可向外发展，但勿迫性，有贵人扶助，可得财喜，出入平安。",
        "女": "玉造行运交泰，如月之明，各事贤玉技巧，春夏月虽有小疾无妨，卦中有吉星守命平安。"
      },
      {
        "年龄": "30-55岁",
        "男": "乾造步运亨通，如日东升，做事老练，春夏月小疾口舌无妨，宜从正经营，有贵人扶助可得财星。",
        "女": "坤造行运交泰，如月之明，贤淑智慧，虽有小疾无妨，勿操迫，幸卦中有吉星守命出入平安。"
      },
      {
        "年龄": "56-69岁",
        "男": "台造步运亨通，如日东升，老练忠诚，可向外发展，定卜有贵人扶助，可得财运出入平安。",
        "女": "坤造行运交泰，如月之明，凡事勿操迫，春夏月虽有小疾无妨，幸吉星守度平安。"
      },
      {
        "年龄": "70岁以上",
        "男": "台造老运安康，惟防春夏月灾疾，守旧，幸福星扶照晚景胜前平安。",
        "女": "坤造老运康泰，旺益子孙，春夏月暗疾无妨，吉星守度，出入平安。"
      }
    ]
  },
  "生意": {
    "生意": "灾过运来得意开，上年赫神恩要还，春夏应防风雨阻，秋冬时节财利来。",
    "生意解曰": "生意初时利薄又防阻隔，交易宜从正道勿贪心妄取六，八，十一月有贵人可得厚财",
    "开铺": "卜开铺之卦宜先改谢前年神恩，十一月应防劫厄，上春有阻勿灰心，秋后可得利。",
    "合伙": "合伙经营必先改谢神恩伙计之间必须同心同德言行一致，六，八，十一月可得财利。",
    "置货": "置货一事，因有神愿未谢，应及早改谢，后置货精心保管， 秋后可得大利。"
  },
  "出外": {
    "出外": "卜出外一事可大胆往前，凡事勿疑于二，三，五月一派好运自有贵人名利成就。"
  },
  "谋望求财": {
    "谋望": "沉迷踪迹未享通，今日承恩谢苍穹，改正前非行大道，自然财禄渐兴隆。",
    "谋望解曰": "谋事前有阻隔，是无先许吓神恩，今欲重谋必先改谢神恩交秋后谋定成之",
    "求财": "正财初时利薄，应求神后无谢神应当天改谢之宜正道经营交六，八，十二月地派兴旺重倍偏财勿取!"
  },
  "学艺功名": {
    "学艺": "卜学艺之卦，宜择吉日进艺门拜良师，勤学苦练定可学得手艺随身。",
    "功名": "功名成就，荣宗耀祖，应谢天地浓恩。"
  },
  "行舟六畜": {
    "行舟": "行舟顺风得利，满载荣归，大吉大利。",
    "六畜": "初时有阻宜谢神，喂养六畜手欲动。休教虚度年月日，可保平安利倍增。",
    "猪羊": "",
    "草龙": "",
    "三鸟": "",
    "田蚕": ""
  },
  "移徙": {
    "移徙": ""
  },
  "行人": {
    "诗": "",
    "解曰": ""
  },
  "婚姻": {
    "婚姻": "前缘配偶是今生，莫为资财重与轻，自有贵人扶持处，手攀丹桂上蟾宫。",
    "解曰": "婚姻是前缘配偶，不要计较资财轻重，自有贵人扶持定能成之"
  },
  "官讼": {
    "官讼": "",
    "解曰": ""
  },
  "失物": {
    "失物": "",
    "解曰": ""
  },
  "占病": {
    "占病": "",
    "解曰": ""
  },
  "其他": {
    "灶君": "",
    "阳基": "",
    "六甲": "",
    "子息": "",
    "祖山": "",
    "青草": ""
  }
}