{
  "签号": "第十五签",
  "签名": "诸葛亮出身",
  "签文类型": "谋为果决之兆",
  "卦象": "大吉之卦",
  "生肖": "午马",
  "签文简介": {
    "戏文": "诸葛亮隐居隆中躬耕垄亩，而志在天下。刘备从徐庶荐，三顾茅庐。亮感其情直义重，始与之纵论天下形势，陈治世之策，弄出助刘备逐鹿中原，建立蜀国。",
    "诗曰": "一日赴东升，二日水中明;春风和气暖，禄马进门庭。",
    "内兆": "旭日东升"
  },
  "家宅运势": {
    "签文": "保得自家莫取钱，好香烧炷谢苍天，田蚕六畜皆兴旺，受佛今年胜旧年。",
    "解曰": "吉宅人口可得喜气，但防三四月口舌涉财，主事人不义之财勿取宜虔诚当天改谢神恩，请佛祖福灯安吊门上祭化之后居住财丁兴隆也。"
  },
  "岁君签": {
    "总诗": "月满今霄离海边，时人感仰赖青天，清光照耀难星退，君子求谋便得官。",
    "年龄运势": [
      {
        "年龄": "1-3岁",
        "男": "小孩根基足养，八字清秀，旺益上人并茂，三、四月小疾无妨，吉星寿命绵长。",
        "女": "小女根苗足旺，利益上人并茂，夏月虽有小疾无妨，有吉星守命平安。"
      },
      {
        "年龄": "4-7岁",
        "男": "小儿运限叶吉，生性天真活泼，有旺益上人并茂，夏月小疾无妨，吉星守命平安。",
        "女": "小女今年顺遂，伶俐活泼，旺益上人并茂，夏月虽有小疾无妨，出入平安。"
      },
      {
        "年龄": "8-12岁",
        "男": "小童今年上运，各事伶俐，宜入学校读书，定卜进步，三、四月小疾无妨，吉星守命平安。",
        "女": "小女运限顺吉，伶俐活泼，旺益上人并茂，三、四月小疾无妨，吉星守度平安。"
      },
      {
        "年龄": "13-15岁",
        "男": "童造运度亨通，聪明开窍，可入学校读书，定卜进步，前途有望，出入平安。",
        "女": "玉造运度叶吉，各事伶俐，三、四月虽有小皮疾无妨，有吉星照身出入平安。"
      },
      {
        "年龄": "16-17岁",
        "男": "吉星步运亨通，如日东升，各事通情达理，三、四月小疾无妨，吉星守命平安。",
        "女": "美造运度亨通，如月之明，五行清秀，三、四月小疾无妨，吉星守命渐入佳景平安。"
      },
      {
        "年龄": "18-29岁",
        "男": "英造步运亨通，如日东升，做事才能，三、四月虽有小疾无妨，有贵人扶助，可得财喜，且出入平安。",
        "女": "玉造行运交泰，如月之明，五行清秀，四柱安和，助益家门，三、四月小疾无妨，吉星守命平安。"
      },
      {
        "年龄": "30-55岁",
        "男": "乾造步运亨通，如日东升，老练经济，可得财运，但凡事从正向外发展，有贵人扶助出入平安。",
        "女": "坤造行运交泰，如月之明，贤淑智慧，助益家庭，三、四月虽有小疾无妨，有吉星照身平安。"
      },
      {
        "年龄": "56-69岁",
        "男": "台造步运亨通，如日东升，忠诚老练，有财运可得，但凡事宽怀，三、四月小疾无妨，贵人扶助平安。",
        "女": "坤造行运叶吉，各事智慧，可称内助，但勿操迫，暗疾无妨，三、四月守旧，幸吉星守命平安。"
      },
      {
        "年龄": "70岁以上",
        "男": "台造老运安康，老当益壮，有些小疾无妨，福星拱照，晚景胜前平安。",
        "女": "妇造老运交泰，旺益子孙，有些暗疾无妨，有吉星照身，步入佳景平安。"
      }
    ]
  },
  "生意": {
    "生意": "春夏财利虽有亏，明智壮大购货归，收购货物仓中放，秋冬出售利非微。",
    "生意解曰": "生意之卦如龙蛇混杂，恐三,四月有阻隔应谨慎，有贵人扶助五，八，十一月有厚利。",
    "开铺": "上春恐有阻隔小利，候秋冬月生意兴隆，有贵人扶助源广进。",
    "合伙": "大吉有财利可得但防歹人破坏，忍口舌伙计应同心协力经营顺昌也!",
    "置货": "卜置货初有交拼，若有胆量多取，交秋冬时节货物振价，可得厚财大利也。"
  },
  "出外": {
    "出外": "卜出外一事时运当权，谋事应有胆量任其向往，有贵人扶助可卜名利双全!"
  },
  "谋望求财": {
    "谋望": "此身相逢更遇邀，龙蛇天外拔迢迢，平生伴你营随意，云有天梯水有路。",
    "谋望解曰": "谋事定成但有些口些舌无妨,宜立智前进有贵人扶助可得名利双成",
    "求财": "正财取之有得但恐防三，四月阻隔，应果决进前交五，八，十一月有厚利入手，偏财有小人恐有官非破财，到底平安也!"
  },
  "学艺功名": {
    "学艺": "卜学技之卦，为谋为果决之兆，勿三心二意，应一心一意，下决心学习，定得名师传真艺也。",
    "功名": "功名肖龙猴之人定可显达，余者龙猴科中。"
  },
  "行舟六畜": {
    "行舟": "行舟顺风，时运亨通，得利大吉。",
    "六畜": "六畜肥大且平安，虽有小阻心莫慌。祈祷神明来保佑，猪牛羊群只只全。",
    "猪羊": "",
    "草龙": "",
    "三鸟": "",
    "田蚕": ""
  },
  "移徙": {
    "移徙": ""
  },
  "行人": {
    "诗": "",
    "解曰": ""
  },
  "婚姻": {
    "婚姻": "前生注定是姻缘，好貌才郎登对年，要虔事心酬天地，管教夫妻两团圆。",
    "解曰": "前生注定男才女貌俩相配，宜诚心配偶先谢天地，夫妻可得百年皆老"
  },
  "官讼": {
    "官讼": "",
    "解曰": ""
  },
  "失物": {
    "失物": "",
    "解曰": ""
  },
  "占病": {
    "占病": "",
    "解曰": ""
  },
  "其他": {
    "灶君": "",
    "阳基": "",
    "六甲": "",
    "子息": "",
    "祖山": "",
    "青草": ""
  }
}