{
  "签号": "第三十一签",
  "签名": "打北齐秦家比械",
  "签文类型": "四路虚险之兆",
  "卦象": "下卦",
  "生肖": "寅虎",
  "签文简介": {
    "戏文": "南北朝时周王吞并北齐，下晋阳，攻济南。北齐亲军护卫秦旭，武卫大将军秦彝父子毁家纾难，勤王御敌，均为周行军都总馆杨林杀害，秦家势危，家将秦安帮宁夫人负幼主秦琼突围脱险，逃难路遇程夫人，被收留回家。秦安代行主责，教幼主攻书习武，使秦家锏法得以传于秦琼。",
    "诗曰": "夏月逢天旱，三冬心失收;肥羊遇饿虎，遭遇恐生愁。",
    "内兆": "乌云遮月"
  },
  "家宅运势": {
    "签文": "君家何必惹非灾，南北防七星来?，求祷福神更改吉，不然安得皱眉开。",
    "解曰": "吉宅有七星杀占宅，防三，六，九月灾难口舌失财，火星小心，吓佛祖保平安，请令旗安门上镇宅祭化南北斗星君，居住平安妇人有喜生女勿出外。"
  },
  "岁君签": {
    "总诗": "心事忡忡常不宁，坐得方安又未安，兴意施为全未遂，恰似明月被云迷。",
    "年龄运势": [
      {
        "年龄": "1-3岁",
        "男": "小儿根苗浅薄，惟防上春月灾难波阻，守旧，宜吓月娘化吉方保寿命绵长。",
        "女": "小女根苗虽足，防上春月小疾多事，宜吓月娘化吉守旧方保出入平安。"
      },
      {
        "年龄": "4-7岁",
        "男": "小儿现年运限未美，但嫌执僻，春夏月防小灾疾，吓月娘化吉交秋返运平安。",
        "女": "小女之卦运限未美，哭僻太重，防春夏月灾难，宜吓月娘交秋平安。"
      },
      {
        "年龄": "8-12岁",
        "男": "小童现年运度未美，自执己僻，春夏月小疾波阻，知避暑，吓月娘交秋返运平安。",
        "女": "小女今年运度未遂，春夏月惟防灾难多事，宜知避暑，吓月娘交秋返运平安。"
      },
      {
        "年龄": "13-15岁",
        "男": "小童人虽精通，但防春夏月波灾多疾，吓月娘化吉交秋返运平安。",
        "女": "小女之卦时令未美，春夏月但防灾难多事，守旧并吓月娘化吉交秋平安。"
      },
      {
        "年龄": "16-17岁",
        "男": "祥造现年时令未美，似乌云遮月，虽聪明开窍，但防春夏月小疾多事，吓月娘交秋转运平安。",
        "女": "玉造人虽技巧，但嫌美中不足，似乌云遮月，惟防春夏月多生小疾，宜吓月娘交秋返运平安。"
      },
      {
        "年龄": "18-29岁",
        "男": "英造步运未美，似乌云遮月，但防春夏月灾难口舌小人祸非，戒性，交秋转运贵人扶助平安。",
        "女": "玉造行运未美，似乌云遮月，虽有助益家庭，但防春夏月小疾，口舌吞忍，交秋转运玉体安康。"
      },
      {
        "年龄": "30-55岁",
        "男": "乾造步运似乌云遮月，防春夏月小人不测之祸，凡事从正道，交秋转运贵人扶助平安。",
        "女": "坤造行运虽旺益家庭，但嫌得此挂美中不足，惟防春夏月暗疾口舌，吞忍性气，交秋平安。"
      },
      {
        "年龄": "56-69岁",
        "男": "台造步运不美，签文乌云遮月，惟防春夏月小人嫁祸，闲事切勿近理，交秋转运有贵人扶助平安。",
        "女": "坤造行运未美，虽有旺益家庭，但嫌操心暗疾，宜吞忍口舌，忌看病人，交秋转运平安。"
      },
      {
        "年龄": "70岁以上",
        "男": "福造老运不旺，惟防春夏月灾难跌地之厄，早晚上落下小心，交秋老福安康。",
        "女": "妇造老运不旺，为人多忧多虑，凡事温柔大量，春夏月守旧，上落小心，交秋福体安康。"
      }
    ]
  },
  "生意": {
    "生意": "春夏生意大不祥，正月守分利不偏，祈祷神明力保佑，冬至时节利可添。",
    "生意解曰": "生意如虎上壁财难得，宜守旧业苦力经营秋后可得利，肖牛羊者恐折本招祸",
    "开铺": "卜开铺之卦恐有阻失，肖牛羊者失更大，未开之铺勿开，若是老铺宅应防歹人祸害劫财，宜求佛祖令旗化吉。",
    "合伙": "卜合伙之卦不美如四路虚险之兆，恐伙计有私偏恐惹是非口舌灾难，勿合为要也!",
    "置货": "卜置货恐市情失，无货可取，若有货可取，宜停留至秋冬，可得财利也。"
  },
  "出外": {
    "出外": "卜出外一事四路絮险恐有小人伤害抢劫，宜在家守旧经营则免生愁!"
  },
  "谋望求财": {
    "谋望": "自然心下意忙忙，怎奈他人心自慌，财物如山皆分定，劝君守旧待时光。",
    "谋望解曰": "时令不美谋事难成，肖牛羊之人更不可谋之，定失并防有祸",
    "求财": "正财春夏月跋涉又防阻失，凡事立志经营秋后得利，偏财肖牛羊者勿取，恐吓惹是非受惊!"
  },
  "学艺功名": {
    "学艺": "卜学技艺之卦不美，如乌云盖月之兆，恐学不成，半途而废，寻师学之，便可成功也。",
    "功名": "功名难得，肖牛羊者更免想录取也。"
  },
  "行舟六畜": {
    "行舟": "行舟不吉，仔细行事可以平安也。",
    "六畜": "六畜时运今未通，费尽心机恐成空。借助神力来保佑，交秋月圆才见功。",
    "猪羊": "",
    "草龙": "",
    "三鸟": "",
    "田蚕": ""
  },
  "移徙": {
    "移徙": ""
  },
  "行人": {
    "解曰": "",
    "签文": ""
  },
  "婚姻": {
    "解曰": "婚姻不成，媒人花言巧语不可信以为真，如浪蝶游蜂不可相亲，若成之恐不长久",
    "签文": "花言巧语岂为真，浪蝶游蜂不可亲，不信但看园内物，一番风雨就伤神。"
  },
  "官讼": {
    "解曰": "",
    "签文": ""
  },
  "失物": {
    "解曰": "",
    "签文": ""
  },
  "占病": {
    "解曰": "",
    "签文": ""
  },
  "其他": {
    "灶君": "",
    "阳基": "",
    "六甲": "",
    "子息": "",
    "祖山": "",
    "青草": ""
  }
}