{
  "签号": "第七签",
  "签名": "韩信得志",
  "签文类型": "暗中有喜之兆",
  "卦象": "中平之卦",
  "生肖": "寅虎",
  "签文简介": {
    "戏文": "韩信少贫，称淮阴饿夫，曾受胯下之辱。后为楚执载郎官，项羽轻之。张良知为帅才，说归汉。刘邦拜为师。韩信主练兵，明修栈道而暗渡陈仓，下三秦直迫中原，戎马五年，扶助刘邦，定鼎西汉。",
    "诗曰": "风起见云生，时享运也通;八龙交会日，方遇宝花缘。",
    "内兆": "枯木逢春"
  },
  "家宅运势": {
    "签文": "淹滞消除正可夸，福神明点照君家，从今莫听闲人说，树正何愁月影斜。",
    "解曰": "吉宅喜气盈门，但防小孩生端祸非而分家，主事人勿听妇女人言，宜从正气公正理，则家道可圆，埕口水道不美要修通，厝前受煞求令旗安门。"
  },
  "岁君签": {
    "总诗": "枯木逢春色欲华，愿交树长发萌芽，时人莫把为柴砍，自待春来又发花。",
    "年龄运势": [
      {
        "年龄": "1-3岁",
        "男": "小儿根基足养，八字清格，旺益上人并茂，夏月小疾无妨，吉星守度寿命绵长。",
        "女": "小女根苗足养，有旺益上人并茂，春夏月虽有效皮恙无妨，吉星守命平安。"
      },
      {
        "年龄": "4-7岁",
        "男": "小儿之卦叶吉，天真活泼，有旺益上人并茂，春夏月虽有小皮疾无妨，吉星守度平安。",
        "女": "小女之卦运度顺遂，各事伶俐，利益上人，春夏月虽有些小疾无妨，吉星照身出入平安。"
      },
      {
        "年龄": "8-12岁",
        "男": "小儿今年运度亨通各事伶俐活泼，可培养入学校读书，定卜进步平安。",
        "女": "小女之卦时运交泰，如枯木逢春，旺益上人，小疾无妨，吉星守度平安。"
      },
      {
        "年龄": "13-15岁",
        "男": "童造现运亨通，聪明开窍，宜入学校读书，远景有望而且出入平安。",
        "女": "小女现年交上美运，各事精通，旺益家门财喜，虽有小疾无妨，出入平安。"
      },
      {
        "年龄": "16-17岁",
        "男": "祥造现年转交好运，如枯木逢春，宜学艺业，卦中有贵人扶助，出入平安。",
        "女": "玉造行运交泰，如枯木逢春，助益家庭，春夏月虽有小疾无妨，吉星守度平安。"
      },
      {
        "年龄": "18-29岁",
        "男": "英造步运亨通，如枯木逢春，做事奇才通能，可向外争取，定卜有贵人扶助，可得财喜平安。",
        "女": "玉造行运交泰，如枯木逢春，各事技巧贤玉，夏月虽有小疾无妨，贵人扶助平安。"
      },
      {
        "年龄": "30-55岁",
        "男": "乾造步运亨通，如枯木逢春，奇才老练，宜向前发展，定卜有贵人扶助，可得财喜，出入平安。",
        "女": "坤造行运交泰，各事贤淑智慧，有内助之称，虽有些暗疾无妨，吉星守命可卜出入平安。"
      },
      {
        "年龄": "56-69岁",
        "男": "台造步运亨通，做事忠诚经济，但勿迫性，有些小疾口舌无妨，卦中贵人扶助，可得财运平安。",
        "女": "坤造行运叶吉，虽旺益家庭，但嫌常时暗疾上身，春夏月守旧，幸吉星守度平安。"
      },
      {
        "年龄": "70岁以上",
        "男": "台造得此卦，如枯木逢春，老当益壮，但三、五、八月上落小心，晚景胜前平安。",
        "女": "妇造行运有旺益子孙，但防暗疾，喜孝物勿食，三、五、八月守旧，可吉也。"
      }
    ]
  },
  "生意": {
    "生意": "春夏生意交易稀，秋冬运开有财利，偏财阻失不可取，正道经营防口舌。",
    "生意解曰": "生意经营时令合局,宜刻苦维持经营交叁，五，八月生意兴隆，有大财利可得。",
    "开铺": "卜开铺之卦应防小人口舌，防人不仁宜请招财得君镇宅，求佛祖令旗安门上祭化平安。",
    "合伙": "卜合伙之卦大吉合之可成，但伙计应同心同德协力经营，有大财利可得!",
    "置货": "置货之卦，初时有高价，此货可发售，若是存放货，价恐败也。"
  },
  "出外": {
    "出外": "卜出外一事，时令当权，凡事勿猜测，大胆前往，有贵人重重，可得成就。"
  },
  "谋望求财": {
    "谋望": "人在山中待好音，君人拨探说知音，如今借得东风力，万里扬帆渐转身。",
    "谋望解曰": "谋事可成但初谋之有小人阻隔,待叁，五八月有贵人扶助，到底可以成功。",
    "求财": "正财库取财除时利薄，宜刻苦经营立功志维持交二，五，十一月有厚利可取，偏财切不可取之，取之定失。"
  },
  "学艺功名": {
    "学艺": "学技艺之卦，但恐不成，宜细心寻师，按年岁配合吉日拜师，耐心学习可成。",
    "功名": "功名前科不中者，此科如枯木逢春定中。"
  },
  "行舟六畜": {
    "行舟": "行舟上春不吉，下春顺风得利也。",
    "六畜": "饲养猪羊欲认真，春夏平平也要勤。待到六秋寒冬月，定有财利报汝心。",
    "猪羊": "猪羊养之，饲料调和，春夏虽有些阻隔，但不必忧烦，可卜底子平安得厚利也。",
    "草龙": "饲养草龙，平安顺利，可旺益家庭，母牛可有产牛仔，宜吓伯公保佑平安。",
    "三鸟": "卜三鸟之卦，春夏恐有小疾，不宜多养，吓伯公保佑，秋后转运，可得财利也。",
    "田蚕": "田蚕早不吉，晚大吉，四季雨水略顺。"
  },
  "移徙": {
    "移徙": "移徙春夏不可移，待七、八月移之大吉。"
  },
  "行人": {
    "诗": "有书喜讯送君知，庭内人情小微微，且待三羊四马日，定然衣锦返回圆。",
    "解曰": "卜此行似枯木逢春，有贵人扶助可得名利双成，交三、五、八月有佳音回家。"
  },
  "婚姻": {
    "婚姻": "几年久坐少人招，今日枯枝长嫩条，自是有缘千里合，无缘对面路迢迢。",
    "解曰": "婚姻成之佳人出在远方，有缘千里能相会，若是近方的恐是对面不相逢。"
  },
  "官讼": {
    "官讼": "新事伤人旧事情，劝君休要逞高能。平生惟慎宪台上，此地从来不可登。",
    "解曰": "官讼可胜，但不可告，应以和为贵，若告之，虽赢输钱。"
  },
  "失物": {
    "失物": "分明失落在篱边、不解追寻旧愿改。万事迟疑三五日，也须来复改依然。",
    "解曰": "失物落在近处，认真迅速寻找，三、五日便可找到，若延迟，恐难找到也。"
  },
  "占病": {
    "占病": "为知不肯念弥陀，有事终思旧愿改。若肯有心从改过、不教善者见南柯。",
    "解曰": "占病只因有旧愿，应速还谢，宜扣许太阳太阴经保平安，四方祭送，不可迟疑。"
  },
  "其他": {
    "灶君": "卜此灶位分金合课，但嫌灶前秽气，应常时修理清净，则烹煮兴隆也。",
    "阳基": "阳基起造有小人口舌，须忍之，并从慎起建或小财补贴老阳居，嫌白虎畔受塞，有利宜修整之则吉也。",
    "六甲": "卜此胎六甲生男，但恐根基浅薄，宜吓天地化吉或拜契神明保养育平安。",
    "子息": "子息之卦，如枯木逢春，莫嫌慢得，将来自有富贵之子，继承香灯，荣宗耀祖。",
    "祖山": "卜贵祖佳城有横龙结穴，但嫌水神散出，白虎畔受路煞冲伤，坐向有利宜修水神归口并填浮白虎畔朝顾，又受兜池唇浮安葬之，则财丁可吉安。",
    "青草": "卜此地横龙结穴，但嫌面前崎岖，葬时宜沉阳立唇，还嫌有口舌是非，宜用财帛补助解决，葬后财丁兴旺也。"
  }
}