{
  "签号": "第二十签",
  "签名": "曹操下江南",
  "签文类型": "破船下滩之兆",
  "卦象": "下下之卦",
  "生肖": "丑牛",
  "签文简介": {
    "戏文": "曹操百万雄师下江南，刘备从孔明谋，联吴抗曹，拟火攻。蒋干盗书，曹操中周公谨计，杀蔡瑁张允；又中连环计、苦肉计，连船练兵。于是孔明请东风，火烧赤壁，曹军战船被烧，灰飞烟灭，会军败北。",
    "诗曰": "四野无人到，行人路转迷;虎狼吞瞰地，险处更逢危。",
    "内兆": "破船下滩"
  },
  "家宅运势": {
    "签文": "去年只望今年好，今年何缘又不宁，只为旧房多怪异，却教疑忌损人丁。",
    "解曰": "吉宅人口旺者得喜，衰者破防失之灾，是灶君冲门祖山顺，有利应把灶君祖各宜修理合课向佛祖奉经求佛祖保佑合家平安。"
  },
  "岁君签": {
    "总诗": "有船无楫难撑驾，更被飘流向海洋，嗟叹世人系不得，误人如此走东西。",
    "年龄运势": [
      {
        "年龄": "1-3岁",
        "男": "小儿根苗足养，但防正、四、七月灾难波阻，六甲妇勿抱，吓月娘交秋返运平安。",
        "女": "小女根苗浅薄，惟防正、四、七月小疾波阻，吓月娘化吉交秋返运平安。"
      },
      {
        "年龄": "4-7岁",
        "男": "小儿之卦未美，惟防正、四、七月小疾水厄，水边小心，宜吓月娘，交秋返运平安。",
        "女": "小女运限未美，但防灾难水厄，正、四、七月守旧，宜吓月娘，交秋返运平安。"
      },
      {
        "年龄": "8-12岁",
        "男": "童造时运未美，惟防正、四、七月脚痛手疾，宜守旧，吓月娘，交秋返运，出入平安。",
        "女": "小女之卦未美，惟防灾难水厄，逢水边小心，宜吓月娘，交秋返运平安。"
      },
      {
        "年龄": "13-15岁",
        "男": "童造运度未顺遂，惟防正、四、七月小疾水厄，勿执己僻，吓月娘交秋返运平安。",
        "女": "玉造运限美中不足，惟防灾难水厄，各事小心，吓月娘正、四、七月守旧平安。"
      },
      {
        "年龄": "16-17岁",
        "男": "祥造运度不美，似行舟失楫，但防正、四、七月灾难水厄，逢船过游小心，吓妈祖化吉，交秋平安。",
        "女": "玉造时令未美，似行舟失楫，人虽精巧，惟防脚手痛疾，水边小心，吓妈祖化吉交秋平安。"
      },
      {
        "年龄": "18-29岁",
        "男": "英造步运未美，似行黍失楫，人虽通能，但防正、四、七月灾难口舌，戒忍性气，吓妈祖秋后平安。",
        "女": "玉造行运未遂，虽有助益家庭之心，但防灾难口舌，正、四、七月守旧勿远出，吓妈祖交秋转入佳景。"
      },
      {
        "年龄": "30-55岁",
        "男": "乾造老运不美，白虎星占身，但防正、四、七月小人祸非口舌，交人谨慎，吓妈祖化吉交秋转运平安。",
        "女": "坤造行运不美，白虎星占度，嫌内心迫杂，恐有暗疾口舌，正、四、七月守旧，吓妈祖交秋转运平安。"
      },
      {
        "年龄": "56-69岁",
        "男": "台造步运不美，人虽老练，但嫌性迫，多遭灾难口舌，正、四、七月闲事切勿近理，交秋转运大造平安。",
        "女": "坤造行运虽有内助之德，但嫌操心暗疾，正、四、七月守旧，忌看病人，交秋转运玉体安康。"
      },
      {
        "年龄": "70岁以上",
        "男": "妇造老运不旺，惟防正、四、七月灾难跌地之厄，早晚上落小心，忌看病人，守旧平安。",
        "女": "坤造老运不旺，操心暗疾，忌看病人，正、四、七月守旧，夜时勿外出，交秋可卜平安。"
      }
    ]
  },
  "生意": {
    "生意": "正直守份生意经，偏财一点取不能，货物不宜贪心购，留货秋后价会升。",
    "生意解曰": "生意春夏月财利跋涉，宜守旧正直经营，用心刻苦维持，秋后有财利可得",
    "开铺": "卜开铺之卦时运未通宜从正道过旧经营，秋后有发展可得财利也。",
    "合伙": "卜合伙之卦不美勿为宜若合之定被吞没，定是亏本失利并惹起是非。",
    "置货": "置货初时财利跋涉，还防小人累劫，货物必须小心检点，以守旧，秋后可得利。"
  },
  "出外": {
    "出外": "卜出外之卦不吉，有小人无故生端寄祸，且防水危宜守旧经营，则免生愁也!"
  },
  "谋望求财": {
    "谋望": "千谋万计事难成，枉走江山万里程，不如抽身且守耐，不然别月事来惊。",
    "谋望解曰": "谋事难成时运未到，应该守耐之，若要谋之恐有惊阻，失财祸非之危也!",
    "求财": "正财库取利稀少，又防小人负累，宜刻苦维持宜守旧经营，交秋时令有利可得，偏财难得不可取之，若为之定失也!!"
  },
  "学艺功名": {
    "学艺": "卜学技艺之卦，千谋万计事难成，宜在家自习，暂勿从师，候交泰运，拜师学也。",
    "功名": "功名不中，还恐防失财伤身也。"
  },
  "行舟六畜": {
    "行舟": "行舟不吉，不可出港，若要行舟恐凶。",
    "六畜": "六畜有组须切防，托人养之可平安。求神守旧无他事，不然就有苦加离。",
    "猪羊": "",
    "草龙": "",
    "三鸟": "",
    "田蚕": ""
  },
  "移徙": {
    "移徙": ""
  },
  "行人": {
    "解曰": "",
    "签文": ""
  },
  "婚姻": {
    "解曰": "婚姻不成虽然曾经相许过，只因年命不同，小人重重若作成也恰似梦中",
    "签文": "许了因何又不从，只因年命不相同，莫教勉强心无定，人岂相逢在梦中。"
  },
  "官讼": {
    "解曰": "",
    "签文": ""
  },
  "失物": {
    "解曰": "",
    "签文": ""
  },
  "占病": {
    "解曰": "",
    "签文": ""
  },
  "其他": {
    "灶君": "",
    "阳基": "",
    "六甲": "",
    "子息": "",
    "祖山": "",
    "青草": ""
  }
}