{
  "签号": "第八签",
  "签名": "韩文公冻雪",
  "签文类型": "破船上滩之兆",
  "卦象": "下下之卦",
  "生肖": "丑牛",
  "签文简介": {
    "戏文": "唐韩愈因阻迎佛骨，触怒天颜，被贬潮州府，路过蓝关。遇入雪封冻，几丧生，幸侄韩湘相救助，始免其难。叔侄会于漂江之滨。韩湘劝登仙，韩愈志在家国，谢绝，又因感于世路艰险，乃作诗以宣其悲愤。",
    "诗曰": "水浅孤舟涸，风寒马不前;故人相别去，唱只鹧鸪天。",
    "内兆": "破船上滩"
  },
  "家宅运势": {
    "签文": "不能安分每奔波，惹得家中祸事多，春夏可忧人口病，秋冬又忙损田禾",
    "解曰": "吉宅人口连年灾疾，口舌失财,吓佛祖相保平安，皆因失祀祖上香火应查明奉祀并做过新灶位，埕口水道宜修通，则居住财丁兴旺。"
  },
  "岁君签": {
    "总诗": "因见渔舟上逆滩，渔舟上岸且盘桓，前滩过了为闲事，惟有后滩过更难。",
    "年龄运势": [
      {
        "年龄": "1-3岁",
        "男": "小孩根苗浅薄，但防正、五、九月灾难波阻，六甲妇勿近抱，吓妈祖化吉方保平安。",
        "女": "小女根苗不旺，正、五、九月防风寒灾难，宜守旧，吓月娘改化平安。"
      },
      {
        "年龄": "4-7岁",
        "男": "小儿之卦时令未美，但恐正、五、九月多生灾难波阻，吓妈祖化吉方保平安。",
        "女": "小女之卦未美，防正、五、九月小疾水厄，逢水边小心，吓妈祖化吉平安。"
      },
      {
        "年龄": "8-12岁",
        "男": "小儿运度未美，但防正、五、九月小疾水厄，水边勿近，吓妈祖化吉方保平安。",
        "女": "玉造运度未美，虽活泼，但防正、五、九月小疾水厄，宜守旧，吓月娘改化平安。"
      },
      {
        "年龄": "13-15岁",
        "男": "童造运度未遂，虽聪明开窍，但正、五、九月水边小心，吓妈祖改化方保平安。",
        "女": "玉造运度美中不足，防水厄小疾，二、五、九月池井边小心，吓妈祖化吉平安。"
      },
      {
        "年龄": "16-17岁",
        "男": "祥造步运不美，似破船上滩，惟防正、五、九月小疾水厄，过渡小心，求神明化吉方保平安。",
        "女": "玉造行运美中不足，似破船上滩，虽是技巧，惟防正、五、九月灾疾水厄，吓天地化吉平安。"
      },
      {
        "年龄": "18-29岁",
        "男": "英造步运不美，签文似破船上滩，虽通能，正、五、九月小人口舌是非，凡事戒忍性情，吓妈祖平安。",
        "女": "玉造行运美中不足，似破船上滩，惟防正、五、九月灾疾口舌，凡事吞忍勿执己意，吓妈祖平安。"
      },
      {
        "年龄": "30-55岁",
        "男": "乾造步运不美，似破船上滩，虽有志难伸，正、五、九月小人不测之祸，凡事从正，吓天地化吉保平安。",
        "女": "坤造行运未美，似破船上滩，但防暗疾口舌，凡事吞忍，正、五、九月守旧，吓天地化吉平安。"
      },
      {
        "年龄": "56-69岁",
        "男": "台造步运不美，人虽老练，但防正、五、九月小人起风波，闲事切勿近理，守正业经营，可卜平安。",
        "女": "坤造行运未美，操心暗疾又防口舌多事，凡事吞忍性气，切勿迫性，吓天地化吉平安。"
      },
      {
        "年龄": "70岁以上",
        "男": "台造老运不旺，恐灾难跌地之厄，早晚上落小心，守旧，宽怀大量平安。",
        "女": "妇造老运不旺，恐操心迫杂，暗疾之厄，上落小心，正、五、九月守旧，则吉也。"
      }
    ]
  },
  "生意": {
    "生意": "破船上滩险其中，生意经营有劫凶，来往交易须谨慎，智慧谋取利兴隆。",
    "生意解曰": "生意经营似破船上滩，财利跋涉，防小人阻隔累害，宜谨慎用智悲谋取利。",
    "开铺": "卜开铺之卦不吉恐伙计不同心，有不美之事发生，勿合平安也。",
    "合伙": "卜合伙之卦不吉，恐防伙计不同心，有不美之事发生，勿合平安也。",
    "置货": "卜置货防小人耗动，失败也，若已失过者，可以置之，交秋冬月有财利可得也。"
  },
  "出外": {
    "出外": "出外之卦时令不通恐防小人累害，生端寄祸宜守旧则免生愁。"
  },
  "谋望求财": {
    "谋望": "命里无时莫强求，何须日夜泛渔舟，红鳞已在秋江上，用尽心机不上钩。",
    "谋望解曰": "谋呈要托别人福，春夏谋之不成要待交秋月圆，托人帮助为便可成。",
    "求财": "正财库取利正如镜内之银，看得见取不着，但宜立志气用谋之可得微利，偏财勿取之。"
  },
  "学艺功名": {
    "学艺": "学技艺之卦，因君年命不合时令，运遇未到，且寒窗自习，秋后寻名师学之成也。",
    "功名": "功名只因运未到，不能得中，失也。"
  },
  "行舟六畜": {
    "行舟": "行舟不详，有出难入，待时行之免险也。",
    "六畜": "圈舍饲养猪牛羊，多只阻隔不吉祥。风吹雨打要防失，至切谨记预告言。",
    "猪羊": "猪羊之卦不吉少利，不可贪养，恐防二、五、八月阻失，大只出卖，吓伯公保平安。",
    "草龙": "草龙之卦，恐防疾难之厄，勿贪心使用，应精心饲养，吓伯公保平安。",
    "三鸟": "三鸟之卦，不宜多养，恐防二、五、八月阻失，大只及时出卖，吓伯公保平安。",
    "田蚕": "田蚕早晚二冬少吉怕尾，四季雨水各人福。"
  },
  "移徙": {
    "移徙": "移徙不利，宜守旧待时，渐安旧居也。"
  },
  "行人": {
    "诗": "霸留常挂两头忧，阻隔关山不自由。惆怅凶多怨恨事，更无消息到扬州。",
    "解曰": "行人在外身体健康，但恐小人阻隔，音信稀断，吓妈祖化吉保平安。"
  },
  "婚姻": {
    "婚姻": "旁人只说俩相当，难测胸怀损虎狼，口好不如心内好，不如独枕卧藤床。",
    "解曰": "婚姻不可成就，因为小人语言不够真实，胸怀似虎狼不可相信。"
  },
  "官讼": {
    "官讼": "得知闲处且和闲，扪到人心有恶奸，莫说酒中胡乱语，岂知台上对词难。",
    "解曰": "此讼有败无胜，宜和不宜告，若告之恐受奸害，不可乱说，要抽身不理为吉。"
  },
  "失物": {
    "失物": "为因不慎失马羊，触得心头日夜忧。人眼不如天眼现，分明教尔莫贪谋。",
    "解曰": "失物是贪谋而得来电，因而失之难寻，不得回也，勿乱猜疑人家，免生祸非也。"
  },
  "占病": {
    "占病": "只因小事恼心怀，惹得忧疑杂病来。急向静中求善福，莫教身躯堕尘埃。",
    "解曰": "卜病是由小事操心而引起，应急速静下心来，请良医治疗，向四方祭送大吉。"
  },
  "其他": {
    "灶君": "卜此灶位不美，灶前嫌秽气，宜将灶位退后，做新灶，则烹煮平安大吉。",
    "阳基": "卜阳基龙运不旺，又高低轻重畔，数年败失，宜修整过居住，造新阳基不成有阻，守旧待时吉之。",
    "六甲": "六甲生男，恐防有阻，根基不足，速宜过继或拜契神明保佑，生女宜嫁出。",
    "子息": "子息之卦，比如枝头生一果一果还遭水灾，宜多做善事，求神明保佑，终有麒麟入梦来也。",
    "祖山": "贵祖佳城有结穴，但龙运不旺，水神阳走，坐向有利宜修整龙运并埋水神归口，又掩祭午方煞气之后，财丁兴旺，惟山子分金宜过别地，则子孙平安。",
    "青草": "此地有结穴，但嫌龙运不旺，出水阳走，葬时宜修龙运并理妥水神归口，立唇掩祭午方煞气，葬之则财丁平安也。"
  }
}