{
  "签号": "第四十八签",
  "签名": "黄野仁遇仙",
  "签文类型": "九转丹成之兆",
  "卦象": "大吉之卦",
  "生肖": "酉鸡",
  "签文简介": {
    "戏文": "黄野仁者，山野之骄子也。日受大自然之引诱，出世之心生而日炽。乃刻意求仙，苦未得。日倦睡，魂游而不意遇仙。仙带回洞中炼丹。经日，九转丹成。黄野仁用之，率未成仙，仙使回家。至家，乡里中人均不相识，问及故人，连老者也不知之。黄野仁始知洞中方一日，世上已千年矣。",
    "诗曰": "五色祥云升，霞光满室明;蛟龙奋疾起，倾刻九里程。",
    "内兆": "金蝉脱壳"
  },
  "家宅运势": {
    "签文": "凶杀已去福神来，忽汝家中大发财，此际管教人物旺，秋冬百事真和谐。",
    "解曰": "凶灾当头春夏人口奔波，疾难是非多，失财是厝前受杀冲伤，宜求佛祖令旗安门上祭化保平安，若有喜凶灾可消除。"
  },
  "岁君签": {
    "总诗": "宝镜新磨复见光，四方照耀任行藏，成名久有根基在，润色增光声播扬。",
    "年龄运势": [
      {
        "年龄": "1-3岁",
        "男": "小孩根苗足养，八字成格，旺益上人并茂，春夏月虽有小疾无妨，出入平安。",
        "女": "小女根基稳固，有旺益上人并茂，春夏月虽有小疾无妨，吉星守命出入平安。"
      },
      {
        "年龄": "4-7岁",
        "男": "小儿之卦时令亨通，旺益上人，但夏月汤火小心，虽有小疾无妨，吉星守命平安。",
        "女": "小女运限顺遂，旺益上人，但防三、五月小疾水厄，逢水边小心，幸吉星守命出入平安。"
      },
      {
        "年龄": "8-12岁",
        "男": "小童现年上运，各事伶俐，宜入学校读书，定卜进步，虽有小疾无妨，出入平安。",
        "女": "小女交上美运，各事活泼，可培养温习文化，三、五月虽有小疾无妨平安。"
      },
      {
        "年龄": "13-15岁",
        "男": "童造之卦运度亨通，聪明开窍，宜入学校读书，定卜进步，高迁之贺出入平安。",
        "女": "玉造现年运度甚佳，伶俐活泼，三、五月小疾无妨，但水边小心，幸吉星守命平安。"
      },
      {
        "年龄": "16-17岁",
        "男": "祥造现年运度亨通，如龙得雨，凡事通能特达，学习手艺，夏月虽有小疾无妨，贵人扶助平安。",
        "女": "玉造行运交泰，如龙得雨，各事贤玉，八字清秀，宜学习文化，夏月虽有小疾无妨，吉星守命平安。"
      },
      {
        "年龄": "18-29岁",
        "男": "英造步运亨通，如龙得雨，做事智慧特达，宜向前争取，有贵人扶助，可得财喜平安。",
        "女": "美造行运佳美，如龙得雨，时令交泰，做事智慧，但勿操迫，夏月虽有小疾无妨平安。"
      },
      {
        "年龄": "30-55岁",
        "男": "乾造步运亨通，如龙得雨，做事才能机智，但勿迫性，有贵人扶助，向外发展，可得财喜平安。",
        "女": "坤造行运交佳，如龙得雨，有内助之贤，但勿操迫，夏月虽有小疾无妨，吉星守度出入平安。"
      },
      {
        "年龄": "56-69岁",
        "男": "台造步运上吉，得此卦如龙得雨，为人心直忠诚，夏月虽有小疾无妨，贵人扶助出入平安。",
        "女": "坤造行运甚美，如龙得雨，贤淑智慧，可称内助，但勿操心迫杂，夏月虽有小疾无妨，玉体安康。"
      },
      {
        "年龄": "70岁以上",
        "男": "福造老运得此卦太旺，但防春夏月灾难交脱，守旧，忌入丧门，底子平安。",
        "女": "慈造老运老当益壮，但防暗疾跌地之厄，上落小心，幸吉星守度晚景胜前。"
      }
    ]
  },
  "生意": {
    "生意": "此卦求问生意经，历时凶险已消清，如今借得东风力，生意兴隆财利升。",
    "生意解曰": "数年苦力财利难得，现岁凶险消除无阻，立冬后有厚利，肖龙之人更有财利",
    "开铺": "卜开铺之卦为九转丹成之兆，老铺数年来波阻已过，今年可得厚财利，新开铺宜用苦力经营，冬月有厚利。",
    "合伙": "卜合伙之卦叶吉为金蝉脱壳之兆，除有波阻，伙计宜同心同德协力经营，秋后有大财利伙计有肖龙者更妙。",
    "置货": "置货初时宜现买现卖，且劳力费神，到底涨价，可得厚财利也。"
  },
  "出外": {
    "出外": "卜出外一事有贵人重重在三，五月出外，但平安而且东成西就，有厚财利可得!"
  },
  "谋望求财": {
    "谋望": "百炼千磨方得醇，几年静坐做闲人，如今借得良工力，富贵相逢白色新。",
    "谋望解曰": "谋事防春月有阻，交秋冬月宜用苦力，自有贵人扶助，凡事定能遂心",
    "求财": "正库取财初时利薄宜加苦力维持于五，九，十一月交运可得利，偏财肖龙之人得之，宜忍口舌!"
  },
  "学艺功名": {
    "学艺": "卜学技艺之卦，为九转丹成之兆，时令合局，但君宜下定决心，勤学苦练，定能学得技艺随身。",
    "功名": "功名不中，是时运不通，捐纳也无中纳。"
  },
  "行舟六畜": {
    "行舟": "行舟先难后易，行之大吉。",
    "六畜": "六畜兴旺人今年，大养鸡犬猪牛羊。灾消福来财喜至，鸡肥猪胖牛马壮。",
    "猪羊": "",
    "草龙": "",
    "三鸟": "",
    "田蚕": ""
  },
  "移徙": {
    "移徙": ""
  },
  "行人": {
    "解曰": "",
    "签文": ""
  },
  "婚姻": {
    "解曰": "重夫娶之大吉，正配难成，一方有恋一方无心，正如流水无情恋落花",
    "签文": "重整衣裳衣色新，相思比做自家人，从来只说人才好，低恐人心又染身。"
  },
  "官讼": {
    "解曰": "",
    "签文": ""
  },
  "失物": {
    "解曰": "",
    "签文": ""
  },
  "占病": {
    "解曰": "",
    "签文": ""
  },
  "其他": {
    "灶君": "",
    "阳基": "",
    "六甲": "",
    "子息": "",
    "祖山": "",
    "青草": ""
  }
}