{
  "签号": "第十签",
  "签名": "甘罗十二为丞相",
  "签文类型": "虑而即行之兆",
  "卦象": "以为下卦",
  "生肖": "亥猪",
  "签文简介": {
    "戏文": "甘罗幼聪慧，帝喜之，令其祖带甘罗入朝见驾。帝抱置腿上，摸其头而笑曰：真乃丞相头也。其祖父即命甘罗谢恩受封。帝以君无戏言封甘罗为丞相，时年方十二。",
    "诗曰": "哇在井中鸣，无影但闻声;月牢在底下，有影又无形。",
    "内兆": "黄蜂采花"
  },
  "家宅运势": {
    "签文": "今年田蚕半吉祥，夏秋又恐损牛羊，冬深人口宜祷福，更防凶人跳矮墙。",
    "解曰": "吉宅人口虽有喜气，但防夏月,疾难口舌，失财贼厄，肖牛者防生痛疾，吓佛祖保平安，皆因厝前受水冲伤求佛祖令旗安门上祭化则平安。"
  },
  "岁君签": {
    "总诗": "不论平地与山尖，无限风光总被占，采得百花成蜜后，到头辛苦为谁甜。",
    "年龄运势": [
      {
        "年龄": "1-3岁",
        "男": "小孩根苗虽稳固，但防夏秋月灾难波阻，六甲妇勿近抱，吓月娘保平安。",
        "女": "小女根苗浅薄，惟防四、六、八、十二月灾难波阻，宜吓月娘化吉方保平安。"
      },
      {
        "年龄": "4-7岁",
        "男": "小儿运限未美，四、六、八、十二月防灾难，不可登高玩耍，吓天地化吉方保平安。",
        "女": "小女之卦时令未美，防灾疾波阻，四、六、八、十二月守旧，吓天地化吉方保平安。"
      },
      {
        "年龄": "8-12岁",
        "男": "小童现年运度未美，但防四、六、八、十二月脚手痛疾，不可登高，吓天地化吉方保平安。",
        "女": "小女现年运度未美，惟防四、六、八、十二月小疾波阻，守旧，吓天地化吉方保平安。"
      },
      {
        "年龄": "13-15岁",
        "男": "童造现年未美，人虽聪明，但防脚手阻疾，四、六、八、十二月守旧，不可登高，吓天地平安。",
        "女": "玉造现年未美，惟防脚手痛疾，四、六、八、十二月勿登高，守旧，吓天地化吉保平安。"
      },
      {
        "年龄": "16-17岁",
        "男": "吉造运度未遂，似黄蜂采花，虽有才能，但防四、六、八、十二月小疾口舌，勿执僻，吓天地保平安。",
        "女": "玉造运度美中不足，似黄蜂采花，惟防四、六、八、十二月脚手痛疾，夜时勿独行，吓天地化吉平安。"
      },
      {
        "年龄": "18-29岁",
        "男": "英造步运未美，似黄蜂采花，人虽通能，惟防四、六、八、十二月小人口舌，凡事从正，吓天地平安。",
        "女": "坤造行运未美，似黄蜂采花，虽助益家庭，但防四、六、八、十二月小疾口舌，凡事吞忍，吓天地平安。"
      },
      {
        "年龄": "30-55岁",
        "男": "乾造步运不美，似黄蜂采花，防四、六、八、十二月小人祸非，宜戒忍性情，交接谨慎，吓天地化吉平安。",
        "女": "坤造行运不美，人虽贤淑，但防暗疾口舌，凡事吞忍，四、六、八、十二月守旧，并吓天地化吉方保平安。"
      },
      {
        "年龄": "56-69岁",
        "男": "台造步运未美，似黄蜂采花，虽是老练，但防四、六、八、十二月不测之祸，闲事勿理，吓天地平安。",
        "女": "坤造行运未美，操心暗疾，凡事吞忍，四、六、八、十二月守旧，夜时勿运出，吓天地化吉保平安。"
      },
      {
        "年龄": "70岁以上",
        "男": "台造老运不旺，人虽忠诚，但防灾疾跌地之厄，六、八、十二月上落小心，勿登高，守旧则吉。",
        "女": "妇造老运不旺，虽有旺益子孙，但防暗疾风气，四、六、八、十二月喜孝物勿食，守旧则吉。"
      }
    ]
  },
  "生意": {
    "生意": "今年生意欲认真，慎防盗贼劫财金，夏月莫挂人家账，秋到求财天有心。",
    "生意解曰": "生意虽有财利可得，但恐小人,劫货，交易宜谨慎见利取利，则财利吉也。",
    "开铺": "卜开铺之卦应防盗贼之厄应防小人诱劫财物，铺门有煞，宜请佛祖符令安门上保平安。",
    "合伙": "不成三人四窍伙计不同心，财物恐有走漏，勿合为宜，合之有祸无利也。",
    "置货": "置货恐防小人耗动，交易要认真谨慎，银项必须亲自点交，有小财利可得。"
  },
  "出外": {
    "出外": "卜出外之卦一事要有胆气坚定前往于二，四月有贵人扶助可得名利双全。"
  },
  "谋望求财": {
    "谋望": "托人去干心中事，口好如何心不好，早早回头归故里，痴只常惯受灾残。",
    "谋望解曰": "卜谋事须防歹人阻隔拐骗或抢劫财帛，宜谨慎应防人不仁勿往外谋之。",
    "求财": "正财库取财虽有得，但恐防小人负累，勿信直中直，须防仁不仁，宜从正道经营，偏财失之不可取，肖牛,羊者失更大。"
  },
  "学艺功名": {
    "学艺": "卜学技艺之卦，因时运未至，学而无成，勿枉费工本，自己学习待时机学之。",
    "功名": "功名不中，勿取吉，肖牛羊者切勿取进。"
  },
  "行舟六畜": {
    "行舟": "行舟凶险，切勿行之，守之平安。",
    "六畜": "夏秋凶险损牛羊，任你求神无应天。肥猪还需防盗贼，不如闲手度虚年。",
    "猪羊": "饲养猪羊有失无得，恐防六、九、十二月阻隔，中大只肥猪要及时出卖，吓伯公保平安。",
    "草龙": "草龙之卦，恐防六、九、十二月阻疾，又防盗厄，宜吓伯公保佑平安，如未养者，渐勿购也。",
    "三鸟": "饲养三鸟，恐防六、九、十二月疾病，又防盗厄，三四只可养，多则不得也。",
    "田蚕": "田蚕中平，防损失，四季雨水不吉。"
  },
  "移徙": {
    "移徙": "移徙应防不吉，因地基有灾险也。"
  },
  "行人": {
    "诗": "艰难跋涉万重山，心事茫茫意未还。又恐路途中人毒，凡事凶险在其间。",
    "解曰": "行人在外凶险事多，恐防小人阻隔祸害，回之艰难，宜吓佛祖保佑身体健康。"
  },
  "婚姻": {
    "婚姻": "野草闲花迷更乱，一朝乐极更生悲，虑心直待姻缘到，莫听旁人说是非。",
    "解曰": "不可轻信媒人话，是闲花野草也切不可取之，若取之欢乐一时有祸也。"
  },
  "官讼": {
    "官讼": "世间难成是贪痴，身为螳螂不见机。只想鸣蝉遭汝捕，不知黄雀在后治。",
    "解曰": "官讼要以和为贵，若告之，起初胜，后定败，因为对方有旁人协助支持。"
  },
  "失物": {
    "失物": "失了财宝莫怨天，谁知贤者更为贤。眼见此物入盗手，只在芦花浅水边。",
    "解曰": "失物已入盗贼之手，纵然到处寻找也难寻见，宜细心观察了解或可见踪迹。"
  },
  "占病": {
    "占病": "恶病缠身无奈何，只防沉重见阎罗。如今若要凶星退，速请僧人念弥陀。",
    "解曰": "求神请良医治疗好也，但肖牛羊之人恶症缠身，求佛祖吓送太阳太阴经平安。"
  },
  "其他": {
    "灶君": "卜此灶位不美，灶前迫塞，宜重新做新灶，烹煮兴隆，财丁兴旺也。",
    "阳基": "卜阳宅生蚁，宜立白雄鸡掩祭化吉，欲起新阳宅有阻口舌，需小财利补办，旧阳宅丑未受煞。",
    "六甲": "卜此胎六甲生女安，生男恐防有阻，根基浅薄，宜过拜契神明保平安。",
    "子息": "前恐难得子，得者也少养，宜多行善事，后来自由子孙继承，平安吉祥也。",
    "祖山": "贵祖佳城横龙结穴，但龙运不旺，丑未分金受煞冲伤，坐向有利宜修龙运壮旺并掩祭丑未方煞气，又理水字配合分明，葬之财丁兴旺也。",
    "青草": "此地横龙有结穴，但嫌龙运不旺，应请有福先生做之财丁兴旺，但丑未分金山头勿取，因水字不美，财丁要破失。"
  }
}