{
  "签号": "第三十二签",
  "签名": "袁术称帝",
  "签文类型": "日落斜西之兆",
  "卦象": "以为下卦",
  "生肖": "丑牛",
  "签文简介": {
    "戏文": "东汉末年，十八诸侯攻董卓，孙坚得传国玉玺，传于子孙策。尔后孙策为收复江东，将玉玺向袁术换取精兵三千。袁术得玉玺，顿生野心，于淮南称帝。妄图号令天下。曹操会吕布、刘备三雄讨袁，大败袁军。袁术犯天下恶，被困迫吐血，自取灭亡于江亭。",
    "诗曰": "鹤在笼中内，鱼游于釜中;梨花开带雨，金菊吐无花。",
    "内兆": "众星侵月"
  },
  "家宅运势": {
    "签文": "阴人灾害事如何，只为家中惹鬼多，如今要保平安日，除非寻僧礼达摩。",
    "解曰": "吉宅人口防夏月有疾难祸非失财，是埕口水道不美，内有阴人作动又嫌祖山不顺，有利各要修整清楚向佛祖奉经请达摩祖师福灯安门平安。"
  },
  "岁君签": {
    "总诗": "众星侵月也当防，小口阴人起祸殃，弱也之时休改革，预先借福谢苍穹。",
    "年龄运势": [
      {
        "年龄": "1-3岁",
        "男": "小孩根苗足养，八字成格，有旺益上人并茂，春夏月灾难波阻，吓天地化吉平安。",
        "女": "小女根苗虽足，惟防三、六、九月灾难波阻，宜吓天地化吉，方保寿命绵长平安。"
      },
      {
        "年龄": "4-7岁",
        "男": "小儿之卦未美，似恶星占度，但防三、六、九月小疾多事，宜守旧吓天地化吉方保平安。",
        "女": "小女运限未美，虽有旺益上人，但防三、六、九月灾难波阻，吓天地化吉方保平安。"
      },
      {
        "年龄": "8-12岁",
        "男": "小童现年运度未美，虽伶俐，但防三、六、九月多生灾疾之厄，守旧，吓天地化吉方保平安。",
        "女": "小女现年运度美中不足，惟防三、六、九月灾难波阻，夜勿外出，吓天地化吉方保平安。"
      },
      {
        "年龄": "13-15岁",
        "男": "童造今年运度未遂，虽聪明，但防三、六、九月小疾波灾，吓天地化吉方保平安。",
        "女": "小女现年运度未佳，但防三、六、九月灾疾之厄，夜勿远出，吓天地化吉平安。"
      },
      {
        "年龄": "16-17岁",
        "男": "祥造步运不佳，似花开遭雨，虽通能，但防三、六、九月小人口舌，勿在外惹祸，吓天地化吉方保平安。",
        "女": "玉造行运美中不足，似花开遭雨，虽有助益家庭，但防三、六、九月小疾多灾，守旧，吓天地化吉平安。"
      },
      {
        "年龄": "18-29岁",
        "男": "英造步运未美，人虽才能，但防三、六、九月小人口舌祸非，凡事切勿冲动，吓天地化吉方保平安。",
        "女": "玉造行运得此卦，人虽贤玉，但嫌美中不足，三、六、九月灾难口舌，凡事吞忍，吓天地化吉玉体安康。"
      },
      {
        "年龄": "30-55岁",
        "男": "乾造步运不美，人虽老练，但防三、六、九月歹人嫁祸生非，凡事戒忍性气，吓天地化吉方保平安。",
        "女": "坤造行运不美，人虽贤惠，但防暗疾口舌，凡事吞忍性气，吓天地化吉保平安。"
      },
      {
        "年龄": "56-69岁",
        "男": "台造步运未美，人虽忠诚，但嫌时令未美，惟防三、六、九月歹人不测之祸，平地风波，守旧，底子平安。",
        "女": "坤造行运美中不足，似花开遭雨，惟防暗疾口舌，凡事吞忍性气，守旧底子平安。"
      },
      {
        "年龄": "70岁以上",
        "男": "吉造老运不旺，似花开遭雨，惟防灾难跌地之厄，早晚上落小心，喜孝堂勿进，守旧底子平安。",
        "女": "妇造老运不旺，似花开遭雨，惟防暗疾上身，忌看病人，三、六、九月守旧，底子旺益子孙平安。"
      }
    ]
  },
  "生意": {
    "生意": "守旧经营可平安，小人劫财要提防，百事用心要谨慎，结果只能小利攀。",
    "生意解曰": "生意不贪心妄作，要仍按旧业经营防偷劫，货款出入谨慎用心窍取利也",
    "开铺": "卜开铺之卦不美未开者开勿，已开者必守旧经营勿贪财妄取，防小人防亏本，请佛祖符令镇宅平安。",
    "合伙": "卜合伙之卦似众星侵月之兆，伙计有私心，防小人防亏本，勿合则吉也!",
    "置货": "卜置货初时有阻隔，但要用心窍，后来可得财利也。"
  },
  "出外": {
    "出外": "卜出外一事时令不通，恐吓防小人劫劫财，勿出外宜守旧经营则可安然!"
  },
  "谋望求财": {
    "谋望": "古来名利与兵机，谋望虽多得者稀，若不将心且忍耐，必然失计被人欺。",
    "谋望解曰": "谋事有小人累害有口舌，防祸非失财宜用心窍，用些财帛帮助事可成",
    "求财": "正财利小稀薄防小人耗劫恐要亏本，宜谨慎从正道，偏财阻失不可取，取必失之!"
  },
  "学艺功名": {
    "学艺": "卜学技艺之卦，似众星侵月之兆，恐有小人祸害，恐惹是非，学之难成，宜候时运才学之。",
    "功名": "功名不中，还恐惹祸破财也。"
  },
  "行舟六畜": {
    "行舟": "行舟中平，但恐防有盗贼也。",
    "六畜": "今年六畜难经营，鸡犬无端怪魔王。猪牛羊鹅也有阻，后悔莫及不可行。",
    "猪羊": "",
    "草龙": "",
    "三鸟": "",
    "田蚕": ""
  },
  "移徙": {
    "移徙": ""
  },
  "行人": {
    "解曰": "",
    "签文": ""
  },
  "婚姻": {
    "解曰": "婚姻切切不可拖延，应及早下聘迎娶，若迟延恐失也，今后又恐无妇也",
    "签文": "本来婚偶待团圆，怎奈旁人起祸端，若要事成须速早，不然迟慢守寒年。"
  },
  "官讼": {
    "解曰": "",
    "签文": ""
  },
  "失物": {
    "解曰": "",
    "签文": ""
  },
  "占病": {
    "解曰": "",
    "签文": ""
  },
  "其他": {
    "灶君": "",
    "阳基": "",
    "六甲": "",
    "子息": "",
    "祖山": "",
    "青草": ""
  }
}