{
  "签号": "第十六签",
  "签名": "关公带嫂秉烛待旦",
  "签文类型": "重囚望赦之兆",
  "卦象": "下下之卦",
  "生肖": "巳蛇",
  "签文简介": {
    "戏文": "关羽被曹兵围困土山，为救嫂计，约三事，降汉不降曹。赴许昌途中，夜歇驿馆，曹操欲乱其君臣之礼，使关公与二嫂同处一室，关公乃秉烛立于户外，达旦无倦色。曹操见关公忠义至此，益重之。",
    "诗曰": "秉烛对佳人，风吹烛泪垂;且防猪与犬，恐惹闲中非。",
    "内兆": "浊油点灯"
  },
  "家宅运势": {
    "签文": "只因不肯敬神明，惹得家中事不宁，今岁若除灾与难，除非重整久家声。",
    "解曰": "吉宅人口可得喜气，但防四, 九，十月祸非疾难失财，肖猪狗之人恐惹祸非，宜安份守已，向佛祖奉经拜祖上香灯，做过新灶居住财丁兴旺兴。"
  },
  "岁君签": {
    "总诗": "浊油点灯灯自灭，方才剔起又垂微，长心烧书空劳力，何不将身忙自归。",
    "年龄运势": [
      {
        "年龄": "1-3岁",
        "男": "小孩根苗虽旺，但防四、六、九、十月灾难波阻，六甲妇勿近，向佛祖添油化吉平安。",
        "女": "小女根基浅薄，惟防四、六、九、十月小疾波阻，吓佛祖化吉方保平安。"
      },
      {
        "年龄": "4-7岁",
        "男": "小儿之卦运限未美，但防四、六、九、十月小疾汤火之厄，向佛祖添油化吉平安。",
        "女": "小女现年运限未美，惟防灾难波阻，四、六、九、十月守旧，向佛祖添油化吉平安。"
      },
      {
        "年龄": "8-12岁",
        "男": "童造运度现年时令未美，防波阻之厄，四、六、九、十月守旧，吓佛祖化吉平安。",
        "女": "小女现年运限未美，四、六、九、十月防有小难灾疾，守旧，吓佛祖化吉平安。"
      },
      {
        "年龄": "13-15岁",
        "男": "童造运度未美，虽聪明，但防四、六、九、十月灾难之厄，宜向佛祖添油化吉平安。",
        "女": "玉造运度美中不足，惟防六、九、十月多生波阻水厄，向佛祖添油化吉平安。"
      },
      {
        "年龄": "16-17岁",
        "男": "祥造步运未美，四、六、九、十月恐有小疾口舌，守旧，勿远出，吓佛祖化吉平安。",
        "女": "玉造美中不足，虽技巧，但防四、六、九、十月多事，夜时勿外出，吓月娘化吉平安。"
      },
      {
        "年龄": "18-29岁",
        "男": "英造步运不美，似浊油点灯，惟防六、九、十月小疾口舌，凡事戒忍，向佛祖添油化吉方保平安。",
        "女": "玉造行运不佳，似浊油点灯，人虽贤玉，但防小疾波阻，四、六、九、月夜时勿远出，向佛祖添油平安。"
      },
      {
        "年龄": "30-55岁",
        "男": "英造步运不美，似浊油点灯，人虽老练，但防六、九、十月不测之祸，宜从正不可冲动，吓天地化吉平安。",
        "女": "坤造行运美中不足，人虽贤淑，但嫌操心迫杂，暗疾口舌，六、九、十月吞忍性气，吓老爷化吉方保平安。"
      },
      {
        "年龄": "56-69岁",
        "男": "台造步运不美，虽老练，但防四、六、九、十月灾难口舌，凡事戒忍性情，闲事切勿近理，底子平安。",
        "女": "坤造行运未美，操心暗疾，凡事吞忍，四、六、九、十月守旧，夜时切勿外出，宜静养，底子平安。"
      },
      {
        "年龄": "70岁以上",
        "男": "福造老运不旺，可比风中点烛，惟防六、九、十月灾难跌地之厄，早晚上落小心，守旧则大吉平安。",
        "女": "坤造老运美中不足，操心劳烦暗疾上身，四、六、九、十月守旧，忌看病人，喜孝物勿近则平安。"
      }
    ]
  },
  "生意": {
    "生意": "何必次次费心机，用尽苦力财力稀，口舌欲任偏财勿，正财守旧能得利。",
    "生意解曰": "生意似穿破鞋过水，防小人耗财，与人交易信直中直，宜苦力不从经营可得财力",
    "开铺": "卜开铺之卦为浊油点灯，恐防大火是非口舌，小人耗财宜过旧经营平安也。",
    "合伙": "卜合伙之卦不吉伙计多心，恐防是非口舌，亏本切勿合，合之定失!",
    "置货": "卜现年置货小利，宜用苦心经营，恐防口舌是非，不可贪财利则吉。"
  },
  "出外": {
    "出外": "卜出外一事因时令不美，恐防小人生端，宜守旧经营方保无忧!"
  },
  "谋望求财": {
    "谋望": "覆危渡水两头难，万计千磨财利艰，守份安贫宜忍耐，忙忙劳力不如闲。",
    "谋望解曰": "谋事不成如破鞋覆渡水，艰难重重防歹人祸害，九，十月更应谨慎防备",
    "求财": "正财库利小九，十月有歹徒负累，宜稳重谨慎经营，见利取利得之安，偏财定失，分文勿取也!"
  },
  "学艺功名": {
    "学艺": "卜学技艺之卦不美，恐君主意不定，三心二意，半途而废，一无所成也。",
    "功名": "功名不中，肖猪者若进场，恐不吉有失。"
  },
  "行舟六畜": {
    "行舟": "行舟不顺，切不可行，守旧平安。",
    "六畜": "今年六畜财利疏，不可贪心想养多。阻隔须吓伯公去，保佑平安灾祸无。",
    "猪羊": "",
    "草龙": "",
    "三鸟": "",
    "田蚕": ""
  },
  "移徙": {
    "移徙": ""
  },
  "行人": {
    "解曰": "",
    "签文": ""
  },
  "婚姻": {
    "解曰": "婚姻不成有小人重重，纵然成之恐不长久，也许被歹徒占有",
    "签文": "方才说起惹忧愁，想是姻缘不到头，如今若得言相许，又恐吓旁人暗里谣。"
  },
  "官讼": {
    "解曰": "",
    "签文": ""
  },
  "失物": {
    "解曰": "",
    "签文": ""
  },
  "占病": {
    "解曰": "",
    "签文": ""
  },
  "其他": {
    "灶君": "",
    "阳基": "",
    "六甲": "",
    "子息": "",
    "祖山": "",
    "青草": ""
  }
}