{
  "签号": "第五签",
  "签名": "苏东坡游江",
  "签文类型": "心动意和之兆",
  "卦象": "大吉之卦",
  "生肖": "辰龙",
  "签文简介": {
    "戏文": "宋苏东坡与佛印善同游河，遇渔翁父女，邀过船饮，苏与佛印吟诗索对，渔翁欲唱和，两人自恃博学精思，笑置之。不料渔女精思敏捷，每求对，辄暗示其父，遂难倒苏学士，使苏两人作山外山之叹。",
    "诗曰": "威武逞英雄，时享运也通;鹿行方见马，遇贵喜重重。",
    "内兆": "顺水行舟"
  },
  "家宅运势": {
    "签文": "门庭兴旺福神多，人虽无灾百事和，春夏宜防官灾疾，秋冬财物满庭稼。",
    "解曰": "喜气盈门，但防春夏月小疾,及火星之厄，早晚火烛小心，是厝内土神愿和久年香火神恩过旺宜安谢土地神恩则财丁昌盛。"
  },
  "岁君签": {
    "总诗": "舟行风顺去无虑，利涉江湖正遇时，万里程途只可到，所谋遂意事如期。",
    "年龄运势": [
      {
        "年龄": "1-3岁",
        "男": "小儿根基足养，八字清秀，有旺益上人并茂，夏月小疾无妨平安。",
        "女": "小女根苗足养，旺益上人并茂，夏月小疾无妨，定卜出入平安。"
      },
      {
        "年龄": "4-7岁",
        "男": "小儿运限叶吉，天真活泼，水边小心，幸有吉星照身，出入平安。",
        "女": "小女之卦顺遂，有旺益上人并茂，虽有些小疾无妨，出入平安。"
      },
      {
        "年龄": "8-12岁",
        "男": "小儿现年上运，各事聪明开窍，宜入学校读书，定卜进步，出入平安。",
        "女": "玉造现年交上美运，旺益家门，虽有小疾无妨，吉星照身平安。"
      },
      {
        "年龄": "13-15岁",
        "男": "童造运度亨通，聪明特达，培养入学校读书，前途有望，出入拍平安。",
        "女": "玉造运度顺遂，技巧伶俐，夏月小疾无妨，吉星守命，出入平安。"
      },
      {
        "年龄": "16-17岁",
        "男": "祥造步运亨通，做事通能特达，学习文化，远景有希望，出入平安。",
        "女": "玉造行运交泰，如顺水行舟，助益家门财喜，小疾无妨，出入平安。"
      },
      {
        "年龄": "18-29岁",
        "男": "英造步运亨通，如顺水行舟，奇才特达，但勿迫性，贵人扶助，可得财喜，出入平安。",
        "女": "玉造行运交泰，各事技巧贤淑，夏月虽有小疾无妨，卦中有吉星守度平安。"
      },
      {
        "年龄": "30-55岁",
        "男": "乾造步运亨通，如顺水行舟，奇才通能，可向外发展，有贵人扶助，可得财喜，出入平安。",
        "女": "坤造行运交泰，各事贤淑智慧，旺益家门财喜，虽有暗疾无妨，吉星守合平安。"
      },
      {
        "年龄": "56-69岁",
        "男": "台造步运亨通，如顺水行舟，老练忠诚，虽有小疾无妨，贵人扶助，出入平安。",
        "女": "坤造行运交泰，如顺水行舟，贤淑智慧，暗疾无妨，吉星守命平安。"
      },
      {
        "年龄": "70岁以上",
        "男": "台造老运亨通，老当益壮，有些灾疾无妨，贵人扶助平安。",
        "女": "妇造老运交泰，如顺水行舟，虽有暗疾无妨，吉星照身，晚景胜前平安。"
      }
    ]
  },
  "生意": {
    "生意": "生意兴隆财利开，河有桥来天有阶，五洲四海皆可往，有勇有智有厚利。",
    "生意解曰": "卜生意道路四通八达，与人交易不可乱猜，宜立智，五，八，十一月可得厚财利。",
    "开铺": "卜开铺之卦叶吉但交易宜谨慎，应防人不仁，有贵人扶助财利兴隆。",
    "合伙": "卜合伙之卦叶吉合之可成，但伙计应同心同德协力经营，有大财利可得。",
    "置货": "卜置货者宜占前，不可乱疑，须立胆智置而存之，五、八、十一月有利可得也。"
  },
  "出外": {
    "出外": "卜出外一事时令当权，凡事勿猜测，大胆前往有贵人重重可得成就。"
  },
  "谋望求财": {
    "谋望": "欲求动止莫怀疑，名利相寻勿待迟，但得便中须速起，休教叹过运中时。",
    "谋望解曰": "做事内心不要乱怀疑要有胆智,灵活谋之交秋后有贵人扶助定可成功。",
    "求财": "正财库取利宜立智经宜,创举宜占先有贵人扶助可得厚财利，偏财取之恐有失，宜和人家合伙移他人之福也。"
  },
  "学艺功名": {
    "学艺": "卜学艺之卦，与君年命合局，但应忍口舌，刻苦学习，有贵人扶助，定能手艺随身。",
    "功名": "功名准得，武者更为荣贵，营伍可升。"
  },
  "行舟六畜": {
    "行舟": "行舟初时不吉，到底可顺风得也。",
    "六畜": "猪肥牛壮兴旺期，快速饲养莫延迟。天定财利合道理，大投资金收大利。",
    "猪羊": "卜饲养猪羊，饲料调和，可大胆多养，平安顺利，大落资本便可得到大利。",
    "草龙": "饲养草龙水草调和，养之顺利，可旺益家庭，有利可得也。",
    "三鸟": "饲养鸡鹅鸭，大吉顺利，可投资金，大胆多养，各事宜精心管理，有财利也。",
    "田蚕": "田蚕早晚冬大吉，四季风调雨顺也。"
  },
  "移徙": {
    "移徙": "移徙大吉，速速可移，新宅可居之。"
  },
  "行人": {
    "诗": "归期眼望恨悠悠，争奈淹留不自由。若得福神添力佑，轻帆风送即登舟。",
    "解曰": "行人去后无音信者，是因途中有小疾，吓佛祖保平安，有贵人扶助，五、八月有佳音。"
  },
  "婚姻": {
    "婚姻": "婚姻到日不须寻，何必区区枉用心，两边相许无他事，正好乘时射雀屏。",
    "解曰": "婚姻成就百说百合，小登科已到在吉顺也，要借此时运托人说亲也。"
  },
  "官讼": {
    "官讼": "理直何须问上真，纵经官府不受刑。虽然目下多惶恐，定保平安理直伸。",
    "解曰": "官讼得理，无须忧疑，不用烦恐，定能伸张得理，但和之更妙，大吉平安。"
  },
  "失物": {
    "失物": "昨日偏舟过洞庭，知君心上不安宁。虽然失却凡间物，终有还珠且莫惊。",
    "解曰": "东西虽已失去，自然有贵人告诉知音，如数归回，君心上不必忧烦也。"
  },
  "占病": {
    "占病": "谁觉追来疾似风，巫医扁鹊枉施工。但望福神来保佑，病魔退却不相逢。",
    "解曰": "占病者阴邪交缠，宜许吓土神，向四方祭送，请良医治之，病可治愈。"
  },
  "其他": {
    "灶君": "卜此灶位分金合于八宅之课，但嫌灶前秽气，常时宜修理清净，则烹煮叶吉也。",
    "阳基": "卜阳宅欲起造吉，但嫌有些口舌宜忍可成，旧阳宅如坐南向北分金防白虎畔石煞及凶，有利修整则平安。",
    "六甲": "此胎六甲定生男儿，平安也，若产妇相马者定生双胎男儿，吓佛祖天地平安。",
    "子息": "子息之卦初时多花少果，宜为世人多做善事，日后定有贵子可得。",
    "祖山": "卜贵祖佳城横龙结穴，气脉足旺，但嫌白穴低，坐向有利宜修高三五尺，沉阳做又消纳白虎畔相朝之后才兴旺。",
    "青草": "卜此地横龙结穴，气脉足旺，但葬时须将穴位点高三五尺，沉阳做，清掩白虎畔，使之相朝，则葬后财丁兴旺。"
  }
}