{
  "签号": "第二十九签",
  "签名": "郭子仪拜寿",
  "签文类型": "春来花发之兆",
  "卦象": "上上之卦",
  "生肖": "辰龙",
  "签文简介": {
    "戏文": "唐郭子仪战功显赫，后又平定安史之乱，以年事高解封王，享厚禄而名潢天下，又适逢八十大寿，七子八婿登堂拜寿，满朝文武入府祝遐，连日喜庆，朝野称贺，热闹非凡。古今辅天地、关家国而得功成名就，福禄寿全者至于斯而已也。",
    "诗曰": "新荷初出来，花叶正发开;鬼抱心中斗，名传天下知。",
    "内兆": "花木逢春"
  },
  "家宅运势": {
    "签文": "敬神自是合天心，人善神饮祸不侵，此不淹留无阻滞，田蚕十倍在深秋。",
    "解曰": "吉宅喜气临门田蚕十倍，但嫌夏月人口有小疾口舌涉财，每逢塑望应诚心敬拜佛祖，天地保平安，埕口水道秽修通。"
  },
  "岁君签": {
    "总诗": "阴阳相合事亨通，如今行在明月中，琴瑟调各门户吉，荣华富贵喜重重。",
    "年龄运势": [
      {
        "年龄": "1-3岁",
        "男": "小孩根苗足养，八字清秀，有旺益上人并茂，上春月虽有小疾无妨，吉星守命平安。",
        "女": "小女根基足养，有旺益上人并茂，上春月虽有小疾无妨，吉星守命出入平安。"
      },
      {
        "年龄": "4-7岁",
        "男": "小儿现年运限顺遂，利益上人，上春月小疾无妨，水边小心，吉星守命出入平安。",
        "女": "小女现年运限叶吉，旺益上人，上春月皮疾无妨，水边小心，吉星守命出入平安。"
      },
      {
        "年龄": "8-12岁",
        "男": "小童之卦时令亨通，天真伶俐，培养入学书，定卜进步，吉星照身出入平安。",
        "女": "小女运度叶吉，各事活泼，上春月水边勿近，虽有小疾无妨，吉星守度出入平安。"
      },
      {
        "年龄": "13-15岁",
        "男": "童造现年时令甚佳，各事开窍聪明，勤奋学习文化，定卜进展，出入平安。",
        "女": "小女运度交佳，凡事伶俐精通，但水边小心，上春月虽有小疾无妨，出入平安。"
      },
      {
        "年龄": "16-17岁",
        "男": "祥造运度亨通，如春来花发，做事聪明有智，不可忽视文化，将来有进展之日，出入平安。",
        "女": "玉造行运交泰，如春来花发，凡事技巧，八字清秀，多学艺业，虽有小疾无妨，出入平安。"
      },
      {
        "年龄": "18-29岁",
        "男": "英造步运亨通，如春来花发，做事通能特达，可向外发展经营，有贵人扶助，可得财喜平安。",
        "女": "坤造运度顺遂，如春来花发，智慧贤玉，助益家庭，上春月虽有小疾无妨，出入平安。"
      },
      {
        "年龄": "30-55岁",
        "男": "乾造步运顺吉，如春来花发，来练奇才，宜立凌云壮志，发展前途有贵人扶助，可得财喜平安。",
        "女": "坤造行运交泰，如春来花发，做事智慧，但勿操迫，有些暗疾无妨，吞忍性气，吉星守命平安。"
      },
      {
        "年龄": "56-69岁",
        "男": "台造步运亨通，为人老练忠诚，签文如春来花发，上春月虽有小疾无妨，贵人扶助出入平安。",
        "女": "坤造行运交泰，贤淑温柔，旺益家门，但有些暗疾无妨，卦中有吉星照身，可卜出入平安。"
      },
      {
        "年龄": "70岁以上",
        "男": "福造老运安康，如春来花发，老当益壮，为人宽宏大，定卜晚景胜前平安。",
        "女": "妇造老运康泰，有旺益子孙，有些暗疾无至大害，太阴星守度平安。"
      }
    ]
  },
  "生意": {
    "生意": "山荼荷花不合丘，初时磨苦小利酬，和气待人心头记，硕果遍地大丰收。",
    "生意解曰": "生意合伙不利有阻失，独做二，三磨苦小利，交五，八，十一月生意兴隆可得大利",
    "开铺": "卜开铺之卦如春来花发之兆，生意兴隆可独占鳌头，五月起可得厚财利，但应忍口舌文明经商。",
    "合伙": "卜合伙之卦不吉恐伙计各有私心防是非口舌防阻失，勿合!",
    "置货": "置货一卦，初时劳苦，财利稀薄，八月起物价渐有提升，到底可得财利也。"
  },
  "出外": {
    "出外": "卜出外之卦似春花开之发，凡事勿疑有胆往外，有贵人扶助可得名利双全。"
  },
  "谋望求财": {
    "谋望": "十年辛苦在寒窗，一旦翻身入选场，幸得朝庭用智士，传扬天府姓名香。",
    "谋望解曰": "谋望;定成有贵人扶助，谋之即可随意但肖龙之人切不可谋，恐祸非失财也!",
    "求财": "正财初时稀薄，宜刻苦维持二，五，八，十一月有贵人扶助可得大财利偏财初有恐失，但到得底得大利!"
  },
  "学艺功名": {
    "学艺": "卜学技艺之事叶吉，宜坚心立志，勤恳向上，多问多想，自能得到名师传精艺也。",
    "功名": "现科文武功名皆中，荣宗耀祖封妻荫子。"
  },
  "行舟六畜": {
    "行舟": "行舟平安，顺风得利也。",
    "六畜": "初时六畜运未通，待到时来花自红。红花点点来庆贺，大好财利在秋冬。",
    "猪羊": "",
    "草龙": "",
    "三鸟": "",
    "田蚕": ""
  },
  "移徙": {
    "移徙": ""
  },
  "行人": {
    "解曰": "",
    "签文": ""
  },
  "婚姻": {
    "解曰": "婚姻成之大吉，两人相合不用媒人，待月明之时便可下聘，就可成功也?",
    "签文": "赤绳系足问前程，不用求谋事以成，丝牵月明缘份到，静坐好听凤凰鸣。"
  },
  "官讼": {
    "解曰": "",
    "签文": ""
  },
  "失物": {
    "解曰": "",
    "签文": ""
  },
  "占病": {
    "解曰": "",
    "签文": ""
  },
  "其他": {
    "灶君": "",
    "阳基": "",
    "六甲": "",
    "子息": "",
    "祖山": "",
    "青草": ""
  }
}